Keyword,Country,Difficulty,Volume,CPC,CPS,Parent Keyword,Last Update,SERP Features,Global volume,Traffic potential,First seen
wildcraft school bags,us,0.0,20.0,,,college bags for girls,########,"Thumbnail,Image pack,Discussions",3700.0,30.0,
heavy duty book bags school,us,0.0,20.0,0.8,,heavy duty backpacks for school,########,"Shopping results,Thumbnail,Discussions,Image pack",30.0,90.0,
stroller school bags,us,0.0,20.0,0.9,,trolley school bags,########,"Thumbnail,Image pack,Shopping results,Sitelinks",20.0,40.0,
billabong school bags,us,,20.0,,,,,,500.0,,
canvas school bags,us,1.0,20.0,,,canvas backpack,########,"Shopping results,Thumbnail,Image pack,Videos",200.0,2600.0,
shoulder book bags for school,us,0.0,20.0,,,shoulder bags for school,########,"People also ask,Thumbnail,Image pack,Shopping results,Discussions",60.0,600.0,
chocolate milk bags school,us,0.0,20.0,,,bag chocolate milk,########,"Thumbnail,People also ask",30.0,250.0,
galaxy school bags,us,0.0,20.0,,,galaxy backpack,########,"Shopping results,Thumbnail,Image pack",100.0,250.0,
gap school bags,us,0.0,20.0,,,gap backpack,########,"Shopping results,Thumbnail,Image pack",90.0,200.0,
period bags for school,us,2.0,20.0,,,period bags,########,"Thumbnail,People also ask,Discussions,Shopping results",50.0,250.0,
converse school bags,us,0.0,20.0,,,converse backpack,########,"Thumbnail,Shopping results,Image pack",150.0,1800.0,
women's book bags for school,us,,20.0,,,,,,20.0,,
school lunch milk bags,us,0.0,20.0,,,school lunch milk bag,########,"Image pack,Thumbnail,People also ask,Discussions,Shopping results",20.0,500.0,
eastpak school bags,us,0.0,20.0,,,eastpak backpack,########,"Shopping results,Thumbnail,Discussions,Image pack",300.0,1100.0,
girls' tote bags for school,us,2.0,20.0,,,tote bag for school,########,"Thumbnail,Discussions,Image pack",30.0,2500.0,
school bags boys,us,9.0,20.0,,,boys' school backpacks,########,"Thumbnail,Shopping results,Discussions,Image pack,Videos",800.0,1200.0,
girl school bags at target,us,8.0,20.0,0.0,,girls school bag,########,"Thumbnail,Shopping results,Image pack",20.0,400.0,
high school baseball bags,us,2.0,20.0,,,best youth baseball bag,########,"Shopping results,Thumbnail",20.0,350.0,
fashionable school bags,us,2.0,20.0,,,cute trendy backpacks,########,"Thumbnail,Discussions,Shopping results,Image pack",150.0,200.0,
school milk bags for sale,us,1.0,20.0,,,driftwood chocolate milk,########,"Thumbnail,People also ask,Image pack,Shopping results",20.0,50.0,
1980's 1980 school bags,us,0.0,20.0,,,1980s school bags,########,"Image pack,People also ask,Thumbnail,Shopping results",100.0,10.0,
adidas school bags for boys,us,0.0,20.0,,,backpacks for boys,########,"Thumbnail,Image pack,Shopping results",150.0,600.0,
personalised school book bags,us,0.0,20.0,,,personalised school bags,########,"Thumbnail,Shopping results,Image pack",100.0,20.0,
school bags manufacturers,us,,20.0,,,,,,50.0,,
book bags for school online,us,24.0,20.0,0.0,,backpacks for school,########,"Thumbnail,Shopping results,Image pack",40.0,12000.0,
nice school bags,us,11.0,20.0,,,cute backpacks for school,########,"Image pack,People also ask,Thumbnail,Discussions",150.0,800.0,
large satchel bags for school,us,0.0,20.0,,,school satchell,########,"Thumbnail,Image pack",60.0,300.0,
book bags for school girls,us,,20.0,,,,,,50.0,,
vs pink school bags,us,1.0,20.0,0.0,,vs pink backpack,########,"Thumbnail,Image pack,Shopping results",20.0,2200.0,
school bags uk,us,7.0,20.0,,,school bag uk,########,"Discussions,Shopping results,Thumbnail,Image pack",300.0,20.0,
rolling school bags for kids,us,5.0,20.0,0.9,,kids rolling backpack,########,"Shopping results,Thumbnail,Discussions,Image pack",30.0,450.0,
plain school bags,us,0.0,20.0,,,plain backpack,########,Thumbnail,250.0,30.0,
red school bags,us,,20.0,,,,,,100.0,,
bags for back to school,us,17.0,20.0,,,back to school backpacks,########,"Shopping results,Thumbnail,Image pack,Discussions,Videos",50.0,700.0,
first day of school goodie bags,us,0.0,20.0,,,back to school goodie bags for students,########,"Shopping results,Thumbnail,Image pack,Discussions",30.0,30.0,
school book bags for boys,us,7.0,20.0,,,boys' school backpacks,########,"Shopping results,Thumbnail,Image pack",100.0,1300.0,
heatons school bags,us,,10.0,0.0,,,,,10.0,,
singapore school bags,us,,10.0,0.0,,,,,10.0,,
side shoulder bags for school,us,,10.0,,,,,,30.0,,
beatles school bags,us,,10.0,0.0,,,,,10.0,,
cheap side bags for school,us,2.0,10.0,0.0,,school sholder bags,########,"Thumbnail,Shopping results,Image pack",20.0,250.0,
target school bags 2016,us,,10.0,0.0,,,,,10.0,,
school bags with wheels cork,us,,10.0,0.0,,,,,10.0,,
wiggles school bags,us,,10.0,0.0,,,,,10.0,,
flipkart school bags puma,us,,10.0,0.0,,,,,60.0,,
designer school bags for toddlers,us,,10.0,0.0,,,,,10.0,,
bags 4 school,us,,10.0,,,,,,150.0,,
cute messenger bags for middle school,us,,10.0,,,,,,10.0,,
cheap school bags for girls,us,,10.0,,,,,,40.0,,
school bags making machine,us,,10.0,0.0,,,,,10.0,,
school desk chair bags,us,,10.0,0.5,,chair pockets,,,20.0,,
school bags one strap,us,,10.0,0.5,,sling bag,,,20.0,,
school bags waterford,us,,10.0,0.0,,,,,10.0,,
best school bags for college,us,,10.0,,,,,,10.0,,
laptop bags for school,us,,10.0,,,,,,40.0,,
wizards of waverly place school bags,us,,10.0,0.0,,,,,10.0,,
black book bags for school,us,,10.0,,,,,,10.0,,
kids school lunch bags,us,,10.0,,,,,,20.0,,
book bags for back to school,us,,10.0,,,,,,10.0,,
cool school bags for high school,us,,10.0,,,,,,70.0,,
crossbody school bags,us,,10.0,,,,,,30.0,,
genie school bags,us,,10.0,,,,,,4700.0,,
pna cadii school bags price,us,,10.0,,,,,,70.0,,
school desk bags,us,,10.0,0.3,,,,,10.0,,
doraemon school bags online,us,,10.0,0.1,,,,,50.0,,
school bags online sale india,us,,10.0,0.0,,,,,10.0,,
leopard school bags,us,,10.0,0.6,,,,,10.0,,
toy story bags school,us,,10.0,0.04,,,,,10.0,,
high school duffel bags,us,,10.0,,,,,,20.0,,
messenger bags for school books,us,,10.0,,,,,,50.0,,
bean bags for school,us,,10.0,,,,,,40.0,,
school bags 2023,us,,10.0,,,,,,80.0,,
jansport wheeled school bags,us,,10.0,0.0,,,,,10.0,,
diesel school bags in india,us,,10.0,0.0,,,,,10.0,,
school bags new york,us,,10.0,5.0,,,,,10.0,,
walmart school bags canada,us,,10.0,0.0,,,,,10.0,,
aobama school bags price,us,,10.0,0.0,,,,,10.0,,
top school bags,us,,10.0,,,,,,50.0,,
31 school bags,us,,10.0,0.0,,,,,10.0,,
cheap teenage school bags,us,,10.0,0.0,,,,,10.0,,
nike school bags in south africa,us,,10.0,0.0,,,,,10.0,,
hooks for school bags,us,,10.0,,,,,,40.0,,
bentley bags for school,us,,10.0,0.0,,,,,10.0,,
cute nike school bags for girls,us,,10.0,,,,,,100.0,,
best bags for grad school,us,,10.0,,,,,,10.0,,
where can i find cute side bags for school,us,,10.0,0.0,,,,,10.0,,
urban school bags,us,,10.0,0.0,,,,,10.0,,
high end school bags,us,,10.0,2.0,,,,,10.0,,
vegan school bags,us,,10.0,0.45,,,,,10.0,,
japanese school bags sale,us,,10.0,0.0,,,,,10.0,,
girls school bags australia,us,,10.0,,,,,,30.0,,
school bags malaysia online,us,,10.0,0.0,,,,,10.0,,
school rolling bags for girls,us,,10.0,1.0,,,,,10.0,,
girl bags for school,us,,10.0,,,,,,50.0,,
christmas goodie bags for school,us,,10.0,,,,,,10.0,,
steve madden school bags,us,,10.0,,,,,,40.0,,
kids shoulder bags for school,us,,10.0,0.9,,,,,10.0,,
school bags com,us,12.0,10.0,0.0,,school bags,########,"Shopping results,Thumbnail,Image pack",30.0,450.0,
where can i buy tote bags for school,us,,10.0,0.25,,,,,20.0,,
welcome back school bags,us,,10.0,0.0,,,,,10.0,,
teachers leather school bags,us,,10.0,0.5,,,,,10.0,,
school roller bags for girls,us,,10.0,1.1,,,,,10.0,,
kids school bags with wheels,us,,10.0,,,,,,50.0,,
school bags in pakistan,us,,10.0,,,,,,800.0,,
book bags school,us,,10.0,,,,,,20.0,,
american eagle tote bags school,us,,10.0,3.0,,,,,20.0,,
doraemon school bags india,us,0.0,10.0,0.0,,,,,20.0,,
school back bags,us,,10.0,,,,,,20.0,,
mickey mouse school bags online,us,,10.0,0.5,,,,,10.0,,
wildcraft school bags price list,us,,10.0,0.0,,,,,10.0,,
boys adidas school bags,us,0.0,10.0,,,kids backpacks boys,########,"Shopping results,Thumbnail,Image pack",70.0,700.0,
school bags for college girl,us,,10.0,,,,,,70.0,,
side school bags,us,,10.0,,,,,,30.0,,
cute book bags for high school,us,,10.0,,,,,,10.0,,
childrens school bags,us,,10.0,,,,,,250.0,,
top bags for school,us,,10.0,0.0,,,,,10.0,,
one side school bags,us,,10.0,0.0,,,,,10.0,,
popular school bags for teens,us,,10.0,0.0,,,,,10.0,,
school bags for kids singapore,us,,10.0,0.0,,,,,10.0,,
purple school bags,us,,10.0,,,purple backpacks for school,,,200.0,,
best school bags in south africa,us,,10.0,,,,,,100.0,,
customised school bags,us,,10.0,,,,,,150.0,,
cheap kids school bags,us,,10.0,0.0,,,,,10.0,,
minecraft school bags for boys,us,,10.0,0.0,,,,,10.0,,
academy school bags,us,,10.0,,,,,,10.0,,
school bags cheap,us,,10.0,,,,,,100.0,,
tote bags for school cheap,us,,10.0,0.8,,,,,20.0,,
frozen school book bags,us,,10.0,0.45,,,,,10.0,,
monogrammed tote bags for school,us,,10.0,0.45,,,,,10.0,,
school bags with lunch bag attached,us,,10.0,,,,,,20.0,,
school lunch bags sale,us,,10.0,0.0,,,,,10.0,,
cute cheap school bags,us,8.0,10.0,0.3,,cute cheap backpacks,########,"Thumbnail,Image pack,Shopping results",10.0,50.0,
paperchase school bags,us,,10.0,,,,,,10.0,,
ripley school bags,us,,10.0,0.0,,,,,10.0,,
amazon school bags girl,us,,10.0,,,,,,30.0,,
drawstring bags for school,us,,10.0,,,,,,10.0,,
cool tote bags for school,us,,10.0,,,,,,10.0,,
school bags from china,us,,10.0,0.25,,,,,10.0,,
small school bags for ladies,us,,10.0,,,,,,90.0,,
messenger bags for boys school,us,,10.0,0.0,,,,,20.0,,
school bags for girls 2014,us,,10.0,0.0,,,,,10.0,,
wilson school bags,us,,10.0,0.0,,,,,10.0,,
high school musical school bags,us,,10.0,0.0,,,,,10.0,,
mapac school book bags,us,,10.0,0.0,,,,,10.0,,
good quality tote bags for school,us,,10.0,,,,,,10.0,,
girls school bags cheap,us,,10.0,,,,,,30.0,,
where to get cross body bags for school,us,,10.0,0.0,,,,,10.0,,
character school book bags,us,,10.0,0.0,,,,,10.0,,
juice bags elementary school,us,,10.0,,,,,,10.0,,
school satchel bags,us,,10.0,,,,,,80.0,,
school bags for kids near me,us,,10.0,,,,,,100.0,,
personalized kids school bags,us,,10.0,1.0,,,,,20.0,,
waterproof school bags in india,us,,10.0,0.0,,,,,10.0,,
cheap back to school book bags,us,,10.0,0.0,,,,,10.0,,
school bags for class 4,us,,10.0,0.0,,,,,10.0,,
cheap school bags online,us,,10.0,,,,,,30.0,,
cool middle school book bags,us,,10.0,0.0,,,,,10.0,,
school bags online purchase india,us,,10.0,0.0,,,,,10.0,,
eastpak bags for school,us,,10.0,0.0,,,,,10.0,,
school bags for girl,us,,10.0,,,,,,300.0,,
school packed lunch bags,us,,10.0,0.0,,,,,10.0,,
personalised school gym bags,us,,10.0,0.0,,,,,10.0,,
goody bags for school birthday,us,,10.0,,,,,,10.0,,
bags for high school girl,us,,10.0,,,,,,80.0,,
walmart school bags,us,,10.0,,0.7,,,,100.0,,
old school book bags,us,,10.0,,,,,,10.0,,
school cute bags,us,,10.0,,,,,,50.0,,
how to cover school books with paper bags,us,,10.0,0.0,,,,,10.0,,
cool high school book bags,us,,10.0,0.06,,,,,10.0,,
messanger school bags,us,,10.0,1.6,,,,,20.0,,
jane norman school bags uk,us,,10.0,0.0,,,,,10.0,,
wholesale school bags china,us,,10.0,2.5,,,,,20.0,,
popular bookstore school bags,us,,10.0,0.0,,,,,10.0,,
latest school bags designs,us,,10.0,0.0,,,,,60.0,,
online shopping school bags singapore,us,,10.0,0.0,,,,,10.0,,
bags with wheels for school,us,,10.0,,,,,,50.0,,
large school bags for teens,us,,10.0,0.0,,,,,10.0,,
in fashion school bags,us,,10.0,0.0,,,,,10.0,,
3d school bags online,us,,10.0,0.0,,,,,10.0,,
elephant school bags,us,,10.0,0.0,,,,,10.0,,
seat bags for school chairs,us,,10.0,1.1,,,,,10.0,,
school bags for kids girls,us,,10.0,,,,,,200.0,,
jansport tote bags for school,us,,10.0,0.7,,,,,10.0,,
school bags tote,us,,10.0,,,,,,30.0,,
style school bags,us,,10.0,,,,,,60.0,,
buy school bags online,us,,10.0,,,,,,200.0,,
teenage girls school bags,us,4.0,10.0,,,teen girl backpacks,########,"Shopping results,Thumbnail,Image pack,Discussions,Bottom ads,Paid sitelinks",100.0,2100.0,
monsters university school bags,us,,10.0,0.0,,,,,10.0,,
aeropostale tote bags for school,us,,10.0,0.0,,,,,10.0,,
trendy school bags for college,us,,10.0,0.0,,,,,20.0,,
quilted school bags,us,,10.0,0.0,,,,,10.0,,
crocs school bags,us,,10.0,2.5,,,,,10.0,,
milk bags in school,us,,10.0,,,,,,10.0,,
where to buy cute messenger bags for school,us,,10.0,0.0,,,,,10.0,,
sports power school bags,us,,10.0,0.0,,,,,10.0,,
oversized hobo bags for school,us,,10.0,0.0,,,,,10.0,,
barbie school bags snapdeal,us,,10.0,0.0,,,,,10.0,,
girls cheap school bags,us,,10.0,,,,,,40.0,,
kohl's school bags,us,,10.0,,,,,,10.0,,
large school bags for teenage girl,us,,10.0,,,,,,250.0,,
best school bags 2016,us,1.0,10.0,0.0,,best school bags 2016,########,"Thumbnail,Shopping results,Image pack",20.0,20.0,
messengers bags for school,us,,10.0,2.0,,,,,10.0,,
ebay nike school bags,us,,10.0,0.0,,,,,10.0,,
fashionable tote bags for school,us,,10.0,0.0,,,,,10.0,,
large side bags for school,us,,10.0,0.0,,,,,10.0,,
leather satchel bags for school,us,1.0,10.0,1.4,,,,,30.0,,
lands end school book bags,us,,10.0,0.0,,,,,10.0,,
school tote bags for boys,us,,10.0,0.0,,,,,10.0,,
good school bags ireland,us,,10.0,0.0,,,,,10.0,,
girls lunch bags for school,us,,10.0,0.0,,,,,10.0,,
girls school side bags,us,,10.0,0.0,,,,,10.0,,
handbag school bags,us,,10.0,,,,,,70.0,,
school shoulder bags for teenagers,us,,10.0,0.0,,girls purses,,,20.0,,
old school gym bags,us,,10.0,,,,,,10.0,,
school bags kids,us,,10.0,,,,,,350.0,,
cute bags for high school,us,,10.0,,,,,,20.0,,
bags for school teenage girls,us,3.0,10.0,,,teen girl backpacks,########,"People also ask,Discussions,Image pack,Shopping results,Thumbnail",70.0,2100.0,
school bags at lowest price,us,,10.0,0.7,,,,,10.0,,
tumblr bags school,us,,10.0,0.0,,,,,10.0,,
school bags for sale amazon,us,,10.0,0.0,,,,,10.0,,
fifa school bags,us,,10.0,0.0,,,,,10.0,,
different type of school bags,us,,10.0,0.0,,,,,10.0,,
flap bags for school,us,,10.0,2.5,,,,,10.0,,
barbie school bags prices,us,,10.0,0.2,,,,,10.0,,
big crossbody bags for school,us,,10.0,,,,,,20.0,,
deuter school bags,us,,10.0,0.0,,,,,10.0,,
zombie school bags,us,,10.0,0.0,,,,,10.0,,
clear messenger bags for school,us,,10.0,0.45,,,,,10.0,,
girls canvas school bags,us,,10.0,0.1,,,,,10.0,,
school bags for 5th graders,us,,10.0,,,,,,20.0,,
fashion school bags,us,,10.0,,,,,,60.0,,
school bags south africa,us,,10.0,,,,,,100.0,,
kids school bags disney,us,,10.0,0.0,,,,,10.0,,
large black school bags,us,,10.0,0.0,,,,,10.0,,
call of duty school bags,us,,10.0,0.02,,,,,10.0,,
school laundry bags,us,,10.0,0.0,,,,,10.0,,
lunch bags for school kids,us,,10.0,0.0,,,,,10.0,,
custom printed school bags,us,,10.0,9.0,,,,,10.0,,
messenger bags for school at walmart,us,,10.0,0.35,,,,,10.0,,
stylish school bags for college,us,,10.0,0.0,,,,,40.0,,
violetta school bags,us,,10.0,0.15,,,,,10.0,,
unicol school bags,us,,10.0,0.0,,,,,10.0,,
canvas messenger bags for school,us,,10.0,,,,,,10.0,,
doc mcstuffins school bags,us,,10.0,0.0,,,,,10.0,,
a4 school bags,us,,10.0,0.0,,,,,10.0,,
school bags for teenagers uk,us,,10.0,0.0,,,,,20.0,,
doctors express concern over heavy school bags,us,,10.0,0.0,,,,,10.0,,
duckback school bags online shopping,us,,10.0,0.0,,,,,20.0,,
muppet school bags,us,,10.0,0.0,,,,,10.0,,
totem orthopedic school bags,us,,10.0,3.0,,,,,20.0,,
accessorize bags for school,us,,10.0,0.0,,,,,10.0,,
shopping school bags online,us,,10.0,0.0,,,,,10.0,,
cute crossbody bags for school,us,,10.0,,,,,,10.0,,
school supplies clear bags,us,,10.0,0.0,,,,,10.0,,
fashion messenger bags for school,us,,10.0,0.0,,,,,10.0,,
despicable me 2 school bags,us,,10.0,0.0,,,,,10.0,,
school bags in bulk,us,,10.0,,,,,,40.0,,
animated school bags,us,,10.0,14.0,,,,,30.0,,
girls messenger school bags,us,,10.0,,,,,,20.0,,
trolley school bags price in india,us,,10.0,0.0,,,,,20.0,,
walmart school lunch bags,us,,10.0,0.0,,,,,10.0,,
kitex dezire school bags,us,,10.0,0.0,,,,,20.0,,
trolley bags for school amazon,us,,10.0,0.45,,,,,10.0,,
trolley school bags flipkart,us,,10.0,0.0,,,,,40.0,,
swissgear school bags,us,,10.0,0.0,,,,,20.0,,
best school bags 2022,us,,10.0,,,,,,20.0,,
kinds of school bags,us,,10.0,0.0,,,,,10.0,,
school bags import from china,us,,10.0,,,,,,30.0,,
best large tote bags for school,us,,10.0,1.1,,,,,10.0,,
school bags for boys near me,us,,10.0,,,,,,150.0,,
bulk school bags,us,,10.0,,,,,,30.0,,
school bags teenage girls,us,,10.0,,,girls purses,,,20.0,,
printed school book bags,us,,10.0,,,,,,70.0,,
winx club school bags,us,,10.0,0.0,,,,,10.0,,
totem school bags prices,us,,10.0,0.0,,,,,10.0,,
dc shoes school bags,us,,10.0,0.0,,,,,10.0,,
clarabella school bags,us,,10.0,0.0,,,,,10.0,,
children's school bags online,us,,10.0,0.0,,,,,10.0,,
high school musical lunch bags,us,,10.0,0.0,,,,,10.0,,
bmx school bags,us,,10.0,0.0,,,,,10.0,,
jack sparrow school bags,us,,10.0,0.0,,,,,10.0,,
high school musical book bags,us,,10.0,0.01,,,,,10.0,,
cloth tote bags for school,us,,10.0,2.5,,,,,10.0,,
children's school lunch bags,us,,10.0,,,,,,20.0,,
girls' bags for school,us,,10.0,,,,,,20.0,,
school tote bags for teachers,us,,10.0,,,,,,10.0,,
book bags for middle school,us,,10.0,,,,,,10.0,,
duffle bags for school,us,,10.0,,,,,,10.0,,
large tote bags for school books,us,,10.0,,,,,,60.0,,
leather school messenger bags,us,,10.0,0.6,,,,,20.0,,
kickers school bags,us,,10.0,0.09,,,,,10.0,,
clipart school bags,us,,10.0,0.0,,,,,10.0,,
wholesale school bags for kids,us,,10.0,0.0,,,,,10.0,,
hello kitty book bags for school,us,,10.0,0.45,,hello kitty backpack,,,20.0,,
school bags for teenage girl ebay,us,,10.0,0.0,,,,,10.0,,
best school bags for sixth form,us,,10.0,,,,,,50.0,,
good bags for school,us,,10.0,,,,,,80.0,,
thanksgiving goodie bags for school,us,,10.0,,,,,,10.0,,
over the shoulder school bags,us,,10.0,,,,,,20.0,,
barbie school bags online,us,,10.0,0.0,,school bag,,,70.0,,
unique school bags for girls,us,,10.0,0.0,,,,,20.0,,
kookai school bags,us,,10.0,0.0,,,,,10.0,,
school trolley bags for kids,us,,10.0,0.0,,,,,20.0,,
seven brand school bags,us,,10.0,2.0,,,,,10.0,,
personalised school bags online india,us,,10.0,0.0,,,,,20.0,,
school vacuum bags,us,,10.0,,,,,,30.0,,
old indian school bags,us,,10.0,,,,,,80.0,,
polly pocket school bags,us,,10.0,0.0,,,,,10.0,,
kids school bags near me,us,,10.0,,,,,,200.0,,
school bags messenger bags,us,,10.0,0.0,,,,,10.0,,
school bags for girls at walmart,us,,10.0,0.15,,,,,20.0,,
boden school bags,us,,10.0,0.4,,,,,10.0,,
bags to school,us,,10.0,,,,,,200.0,,
lunch bags school,us,,10.0,,,,,,10.0,,
school bags jansport,us,,10.0,,,,,,100.0,,
d&g school bags,us,,10.0,0.0,,,,,10.0,,
cartoon school bags buy online,us,,10.0,0.0,,,,,10.0,,
dinosaur school bags,us,,10.0,,,,,,60.0,,
floral print school bags,us,,10.0,0.9,,,,,10.0,,
where to buy deuter school bags in singapore,us,,10.0,0.0,,,,,10.0,,
vintage retro school bags,us,,10.0,0.0,,,,,10.0,,
adidas school bags 2015,us,,10.0,0.0,,,,,10.0,,
ogio school bags,us,,10.0,0.0,,,,,10.0,,
school bags for girls images,us,,10.0,0.0,,,,,10.0,,
school milk in plastic bags,us,,10.0,,,,,,10.0,,
school bags for teen boys,us,,10.0,,,,,,70.0,,
cute leather school bags,us,0.0,10.0,0.45,,leather schoolboy bag,########,"Image pack,Shopping results,Thumbnail",10.0,150.0,
dezire school bags,us,,10.0,0.0,,,,,10.0,,
school rolling book bags,us,,10.0,0.7,,,,,10.0,,
fashionable shoulder bags for school,us,1.0,10.0,6.0,,,,,20.0,,
good tote bags for middle school,us,,10.0,0.15,,,,,10.0,,
amazon school bags,us,,10.0,,,,,,100.0,,
school golf bags,us,,10.0,,,,,,10.0,,
kid school bags,us,,10.0,,,,,,30.0,,
jansport school bags 2011,us,,10.0,0.0,,,,,10.0,,
jansport school bags canada,us,,10.0,0.0,,,,,10.0,,
kmart school bags,us,,10.0,,,,,,900.0,,
school bags uk sale,us,,10.0,0.0,,,,,10.0,,
hot bags for school,us,,10.0,0.0,,,,,10.0,,
girls school bags pink,us,,10.0,0.0,,,,,10.0,,
latest school bags 2015,us,,10.0,0.0,,,,,10.0,,
what are good bags for school,us,,10.0,0.0,,,,,10.0,,
blue book bags for school,us,,10.0,0.0,,,,,10.0,,
tna school bags,us,,10.0,0.0,,,,,10.0,,
large bags for school,us,,10.0,,,,,,20.0,,
girly school bags,us,,10.0,,,,,,40.0,,
school bags for kindergarten boy,us,,10.0,,,,,,40.0,,
burlington school bags,us,,10.0,,,,,,10.0,,
different types of bags for school,us,,10.0,,,,,,20.0,,
school gym bags uk,us,,10.0,0.0,,,,,20.0,,
school bags canvas,us,,10.0,0.01,,,,,30.0,,
old school bags images,us,,10.0,,,,,,40.0,,
school bags online shopping pakistan,us,,10.0,0.0,,,,,10.0,,
preppy bags for school,us,,10.0,,,preppy school bags,,,40.0,,
girls billabong school bags,us,,10.0,0.0,,,,,10.0,,
buy cheap school bags,us,,10.0,,,,,,40.0,,
cheap school tote bags,us,,10.0,0.0,,,,,10.0,,
crossbody tote bags for school,us,,10.0,,,,,,10.0,,
boomerang school bags,us,,10.0,,,,,,4400.0,,
school bags organizer,us,,10.0,,,,,,20.0,,
big shoulder bags for high school,us,,10.0,0.7,,target purses,,,10.0,,
school bags high school,us,,10.0,,,,,,70.0,,
school bags ebay uk,us,,10.0,0.0,,,,,10.0,,
school bags purchase online,us,,10.0,0.0,,,,,10.0,,
nike school bags with price,us,,10.0,0.0,,,,,10.0,,
high school reunion gift bags,us,,10.0,0.0,,,,,10.0,,
school bags online in india,us,,10.0,0.0,,,,,10.0,,
school bags store near me,us,,10.0,,,,,,60.0,,
long side bags for school,us,4.0,10.0,0.4,,school sholder bags,########,"People also ask,Thumbnail,Shopping results,Image pack",20.0,250.0,
back to school messenger bags for girls,us,,10.0,0.0,,,,,10.0,,
gap bags school,us,,10.0,0.0,,,,,10.0,,
buy girls school bags,us,,10.0,,,,,,40.0,,
wheeled school bags,us,,10.0,,,,,,80.0,,
target back to school book bags,us,10.0,10.0,0.03,,backpacks for school,########,"Shopping results,Thumbnail,Image pack",10.0,8500.0,
cheap vintage school bags,us,,10.0,0.0,,,,,10.0,,
school bags shops in chennai,us,,10.0,0.0,,,,,10.0,,
1990s school bags,us,,10.0,,,,,,150.0,,
mackenzie school bags,us,,10.0,0.0,,,,,10.0,,
school bags lego,us,,10.0,0.0,,,,,10.0,,
pastel aesthetic bags for school,us,,10.0,,,,,,20.0,,
cheap shoulder bags for school,us,,10.0,0.0,,,,,20.0,,
bags for boys school,us,,10.0,,,,,,150.0,,
bags for nursing school,us,,10.0,,,,,,10.0,,
messanger bags for school,us,,10.0,,,,,,10.0,,
jack wills school bags ebay,us,,10.0,0.0,,,,,20.0,,
sesame street school bags,us,,10.0,0.0,,,,,10.0,,
urban outfitters bags for school,us,,10.0,0.0,,,,,10.0,,
high school musical loot bags,us,,10.0,0.0,,,,,10.0,,
tommy hilfiger school bags,us,,10.0,,,,,,800.0,,
school bags for college men,us,,10.0,0.0,,,,,10.0,,
pink satchel school bags,us,,10.0,0.0,,,,,10.0,,
polo school bags,us,,10.0,,,,,,600.0,,
online school bags amazon,us,,10.0,0.0,,,,,10.0,,
pink vs school bags,us,0.0,10.0,1.2,,vs pink backpack,########,"Image pack,People also ask,Shopping results,Thumbnail",10.0,1200.0,
chair bags for school by 2dishdesigns,us,,10.0,0.0,,,,,10.0,,
goodie bags for high school students,us,,10.0,,,,,,10.0,,
school gym bags,us,,10.0,,,,,,30.0,,
satchel type school bags,us,,10.0,,,,,,30.0,,
good messenger bags for school,us,,10.0,,,,,,10.0,,
school library bags,us,0.0,10.0,,,kids library bags,########,"Thumbnail,Image pack,Shopping results,Discussions",60.0,50.0,
hollister bags for school,us,,10.0,0.9,,,,,10.0,,
f3 school bags,us,,10.0,0.0,,,,,10.0,,
winx bags school,us,,10.0,0.03,,,,,20.0,,
good school tote bags,us,,10.0,,,,,,10.0,,
designer school bags for teens,us,,10.0,0.0,,,,,10.0,,
nike school bags 2015,us,,10.0,0.0,,,,,10.0,,
school bags sale uk,us,,10.0,0.0,,,,,10.0,,
school bags under 500,us,,10.0,,,,,,300.0,,
dc comics school bags,us,,10.0,0.0,,,,,10.0,,
barbie school bags philippines,us,,10.0,0.0,,,,,20.0,,
good bags for middle school,us,,10.0,0.0,,,,,10.0,,
boys messenger bags for school,us,,10.0,,,,,,20.0,,
large leather school bags,us,,10.0,0.0,,,,,10.0,,
school bags online amazon,us,,10.0,0.8,,,,,10.0,,
school bags online singapore,us,,10.0,0.0,,,,,20.0,,
weed school bags,us,,10.0,1.8,,,,,10.0,,
nice bags for high school,us,,10.0,0.0,,,,,30.0,,
zig zag school bags,us,,10.0,0.06,,,,,20.0,,
low price school bags online,us,,10.0,0.0,,,,,10.0,,
nike school bags mesh,us,,10.0,0.0,,,,,10.0,,
school bags in dubai mall,us,,10.0,0.0,,,,,30.0,,
school bags waterproof,us,,10.0,,,,,,70.0,,
girls crossbody school bags,us,,10.0,0.0,,,,,10.0,,
school bags for nursing students,us,,10.0,,,,,,10.0,,
school bags for kids boys,us,,10.0,,,,,,200.0,,
kids school bags online,us,22.0,10.0,,,school bags for kids,########,"Shopping results,Thumbnail,Discussions,Image pack",450.0,250.0,
nice bags for school,us,,10.0,,,,,,50.0,,
hello kitty bags for school,us,,10.0,,,,,,50.0,,
totes and bags for school,us,,10.0,0.0,,,,,10.0,,
school bags for sale online,us,,10.0,6.0,,school backpacks,,,80.0,,
www school bags,us,,10.0,0.0,,,,,20.0,,
messenger school bags for kids,us,,10.0,0.0,,,,,20.0,,
cool school bags boys,us,,10.0,0.0,,,,,10.0,,
large cross body bags school,us,,10.0,0.3,,,,,10.0,,
school p e bags,us,,10.0,0.0,,,,,10.0,,
where can i buy school bags online,us,,10.0,0.4,,school backpacks,,,20.0,,
aesthetic school bags for high school,us,,10.0,,,,,,250.0,,
rangers school bags,us,,10.0,0.0,,,,,10.0,,
duffer school bags,us,,10.0,0.0,,,,,10.0,,
girls school bags for sale,us,,10.0,0.6,,,,,30.0,,
history of school bags,us,,10.0,,,,,,40.0,,
cheetah bags for school,us,,10.0,0.2,,,,,20.0,,
nursery school bags online india,us,,10.0,0.0,,,,,10.0,,
cheap school purse bags,us,,10.0,0.0,,,,,10.0,,
claire's school bags,us,,10.0,,,,,,20.0,,
school bags online flipkart,us,,10.0,0.35,,,,,150.0,,
pna cadii school bags,us,,10.0,,,,,,50.0,,
school bags online shopping in hyderabad,us,,10.0,0.0,,,,,10.0,,
bean bags for school library,us,,10.0,,,,,,30.0,,
adidas school bags ebay,us,,10.0,0.0,,,,,10.0,,
school bags for girls 2015,us,,10.0,0.0,,,,,10.0,,
crazy school bags,us,,10.0,0.0,,,,,10.0,,
6pm school bags,us,,10.0,0.2,,,,,10.0,,
school book bags walmart,us,,10.0,0.3,,,,,10.0,,
