Keyword,Country,Difficulty,Volume,CPC,CPS,Parent Keyword,Last Update,SERP Features,Global volume,Traffic potential,First seen
cheap satchel bags for school,us,,10.0,0.0,,,,,20.0,,
where can i find cute tote bags for school,us,,10.0,0.0,,,,,10.0,,
school christmas party treat bags,us,,10.0,0.0,,,,,10.0,,
reusable shopping bags school fundraiser,us,,10.0,0.0,,,,,10.0,,
where to buy side bags for school,us,,10.0,0.0,,,,,20.0,,
new stylish school bags,us,,10.0,0.0,,,,,30.0,,
cheap book bags school,us,,10.0,0.0,,,,,10.0,,
super mario bros school bags,us,,10.0,0.0,,,,,10.0,,
school bags at flipkart,us,,10.0,0.0,,,,,10.0,,
cute school bags for college,us,,10.0,,,,,,20.0,,
macy's school bags,us,,10.0,,,,,,10.0,,
high school messenger bags for school,us,,10.0,,,,,,40.0,,
brown cross body bags for school,us,,10.0,0.8,,,,,20.0,,
school bags for girls at target,us,,10.0,0.15,,,,,10.0,,
advertisement for school bags,us,,10.0,0.0,,,,,10.0,,
japanese school bags for sale,us,,10.0,0.04,,,,,10.0,,
school bags side,us,,10.0,0.0,,,,,10.0,,
american apparel school bags,us,,10.0,0.3,,american apparel bookbag,,,20.0,,
red and black school bags,us,,10.0,1.2,,,,,10.0,,
bags for school books,us,,10.0,0.0,,,,,10.0,,
school back bags for girls,us,,10.0,0.0,,,,,10.0,,
cute bags for school tumblr,us,,10.0,0.4,,,,,30.0,,
dgk school bags,us,,10.0,0.0,,,,,10.0,,
school bags nike for boys,us,,10.0,0.45,,,,,10.0,,
affordable tote bags for school,us,,10.0,,,,,,10.0,,
school bags for preschoolers,us,,10.0,,,,,,50.0,,
boy school bags,us,,10.0,,,,,,100.0,,
school bags with name printed,us,,10.0,,,,,,60.0,,
school phone bags,us,,10.0,,,,,,10.0,,
school bags storage ideas,us,,10.0,,,,,,60.0,,
school holiday shop gift bags,us,,10.0,,,,,,10.0,,
character school bags wholesale,us,,10.0,0.0,,,,,10.0,,
school bags for girls singapore,us,,10.0,0.0,,,,,10.0,,
where to get totes bags for school,us,,10.0,0.0,,,,,10.0,,
school bags jansport sale,us,,10.0,1.3,,jansport,,,20.0,,
school bags shopping,us,,10.0,,,,,,20.0,,
solar powered school bags,us,,10.0,0.0,,,,,10.0,,
school bags for high schoolers,us,,10.0,,,,,,20.0,,
roxy school bags sale,us,,10.0,,,,,,10.0,,
school bags for sale online philippines,us,,10.0,0.0,,,,,10.0,,
export school bags 2015,us,,10.0,0.0,,,,,10.0,,
bags for school girls,us,,10.0,,,,,,150.0,,
dr kong school bags,us,,10.0,0.0,,,,,10.0,,
old school satchels bags,us,,10.0,0.0,,,,,10.0,,
middle school lunch bags,us,,10.0,,,,,,10.0,,
fireman sam school bags,us,,10.0,0.5,,,,,10.0,,
boys book bags for school,us,8.0,10.0,0.4,,girls backpacks,,,20.0,,
roxy school messenger bags,us,,10.0,0.01,,,,,10.0,,
really nice school bags,us,,10.0,0.0,,,,,40.0,,
school bags for small kids,us,,10.0,0.0,,,,,10.0,,
cheap school bags for college,us,,10.0,0.0,,,,,10.0,,
pink book bags for school,us,,10.0,,,,,,10.0,,
gymnastics school bags,us,,10.0,0.0,,,,,10.0,,
birthday bags for school,us,,10.0,,,,,,20.0,,
best school bags for kids,us,,10.0,,,,,,100.0,,
heavy duty school bags,us,,10.0,,,,,,100.0,,
school bags for teens girls,us,,10.0,,,,,,20.0,,
raglan point school bags,us,,10.0,0.0,,,,,10.0,,
cross over bags for school,us,,10.0,2.0,,,,,20.0,,
target back to school bags,us,,10.0,0.0,,,,,10.0,,
ed hardy school bags,us,,10.0,0.0,,,,,30.0,,
school bags for kids walmart,us,,10.0,0.4,,,,,10.0,,
old school sleeping bags,us,,10.0,,,,,,10.0,,
wholesale book bags for school,us,1.0,10.0,2.0,,,,,20.0,,
nike school bags 2014,us,,10.0,0.0,,,,,10.0,,
best nursing school bags,us,,10.0,,,,,,10.0,,
cool high school bags,us,,10.0,0.0,,,,,10.0,,
vans school bags australia,us,,10.0,0.0,,,,,20.0,,
best school bags 2014,us,,10.0,0.0,,,,,10.0,,
disney school book bags,us,,10.0,0.0,,,,,10.0,,
animal school bags ebay,us,,10.0,0.0,,,,,10.0,,
old school chopper saddle bags,us,,10.0,,,,,,10.0,,
keychains for school bags,us,,10.0,,,,,,20.0,,
unusual school bags,us,,10.0,,,,,,60.0,,
across the body school bags,us,,10.0,0.6,,,,,20.0,,
school lunch bags online,us,,10.0,1.9,,,,,10.0,,
cheap roxy school bags uk,us,,10.0,0.0,,,,,10.0,,
nike messenger bags for school,us,,10.0,0.0,,,,,20.0,,
lightning mcqueen school bags,us,,10.0,0.6,,,,,10.0,,
vera bradley messenger bags for school,us,,10.0,0.0,,vera bradley laptop messenger bag,,,10.0,,
leather tote bags for school,us,,10.0,,,,,,30.0,,
back to school gift bags for students,us,0.0,10.0,,,back to school gifts,,,10.0,,
tote bags near me for school,us,,10.0,,,,,,10.0,,
valentine's day goodie bags for school,us,0.0,10.0,,,valentines bags for school,########,"People also ask,Shopping results,Thumbnail,Image pack,Discussions",10.0,400.0,
rolling book bags for nursing school,us,,10.0,1.2,,,,,10.0,,
school bags for girls online,us,,10.0,,,,,,150.0,,
across the body bags for school,us,,10.0,1.8,,,,,20.0,,
messenger bags high school girls,us,,10.0,0.0,,,,,10.0,,
school bags for girls teens,us,,10.0,0.0,,,,,20.0,,
jansport mesh school bags,us,,10.0,1.3,,,,,10.0,,
bags for women school,us,,10.0,,,,,,70.0,,
shop for school bags,us,,10.0,0.9,,school backpacks,,,20.0,,
zebra book bags school,us,,10.0,0.35,,,,,10.0,,
family guy school bags,us,,10.0,0.0,,,,,10.0,,
longchamp bags for school,us,,10.0,0.0,,,,,10.0,,
aesthetic school bags,us,,10.0,,,,,,2200.0,,
safari school bags,us,,10.0,,,,,,2600.0,,
school pencil bags,us,,10.0,,,,,,10.0,,
cool school bags 2015,us,,10.0,0.0,,,,,10.0,,
element school bags,us,,10.0,1.1,,,,,40.0,,
personalized school book bags,us,,10.0,1.7,,,,,10.0,,
binder bags for school,us,,10.0,,,,,,10.0,,
where can you buy tote bags for school,us,,10.0,0.0,,,,,10.0,,
primary school bean bags,us,,10.0,,,,,,50.0,,
personalized school messenger bags,us,,10.0,0.15,,,,,10.0,,
school bags for kindergarten online,us,,10.0,0.0,,,,,10.0,,
oversized bags for school,us,,10.0,0.6,,tote bags for school,,,20.0,,
school bags for girls 2016,us,,10.0,0.0,,,,,10.0,,
fabric cross body bags for school,us,,10.0,0.0,,,,,10.0,,
school bags avengers,us,,10.0,0.0,,,,,10.0,,
unme school bags,us,,10.0,0.0,,,,,10.0,,
insulated snack bags for school,us,,10.0,,,,,,10.0,,
school bags india,us,,10.0,,,,,,50.0,,
back to school school bags,us,,10.0,,,,,,40.0,,
harry potter school bags,us,,10.0,,,,,,200.0,,
personalized school lunch bags,us,,10.0,0.0,,,,,10.0,,
cheap fashion school bags,us,,10.0,0.0,,,,,10.0,,
school bags at marshalls,us,,10.0,0.0,,,,,10.0,,
next school bags,us,,10.0,,,,,,600.0,,
school bags girls teenagers,us,,10.0,0.0,,,,,10.0,,
ergonomic school bags for kids,us,,10.0,0.0,,,,,10.0,,
best kids' lunch bags for school,us,,10.0,,,,,,30.0,,
diamond school bags,us,,10.0,0.7,,,,,10.0,,
cross body school bags,us,,10.0,,,,,,10.0,,
school bags back packs,us,,10.0,,,,,,30.0,,
hello kitty school bags,us,,10.0,,,,,,80.0,,
zebra tote bags for school,us,,10.0,0.25,,zebra tote bags,,,20.0,,
totem school bags prices south africa,us,,10.0,0.0,,,,,50.0,,
book bags for girls in middle school,us,,10.0,,,,,,40.0,,
dora the explorer school bags,us,,10.0,0.0,,,,,10.0,,
angry birds bags for school,us,,10.0,0.03,,,,,20.0,,
how to reduce the weight of school bags,us,,10.0,0.0,,,,,10.0,,
treat bags for first day of school,us,,10.0,0.0,,,,,10.0,,
hello kitty school bags for girls,us,,10.0,,,,,,40.0,,
zuca school book bags,us,,10.0,0.15,,,,,20.0,,
high school musical messenger bags,us,,10.0,0.0,,,,,10.0,,
unique tote bags for school,us,,10.0,0.0,,,,,10.0,,
over the shoulder bags for high school,us,1.0,10.0,0.25,,messenger bags,,,10.0,,
tesco back to school bags,us,,10.0,0.0,,,,,10.0,,
pretty little liars school bags,us,,10.0,0.0,,,,,20.0,,
manchester city school bags,us,,10.0,0.0,,,,,10.0,,
hannah montana bags for school,us,,10.0,,,,,,40.0,,
school bags for kids wholesale,us,,10.0,0.0,,,,,20.0,,
princess sofia school bags,us,,10.0,0.5,,,,,10.0,,
winsor school bags,us,,10.0,0.0,,,,,10.0,,
one direction school bags uk,us,,10.0,0.0,,,,,10.0,,
school bags sale philippines,us,,10.0,0.0,,,,,20.0,,
best school lunch bags,us,,10.0,,,,,,10.0,,
best teenage school bags,us,,10.0,,,,,,40.0,,
old school milk bags,us,,10.0,,,,,,10.0,,
children's school bags,us,,10.0,,,,,,150.0,,
school sprayground bags,us,,10.0,,,,,,10.0,,
cath kidston school bags,us,0.0,10.0,,,cath kidston school bags,########,"Thumbnail,Image pack,Shopping results",200.0,10.0,
canvas messenger school bags,us,,10.0,0.0,,,,,10.0,,
school bags online bangalore,us,,10.0,0.0,,,,,10.0,,
fashionable girls school bags,us,,10.0,0.0,,,,,10.0,,
ergo school bags singapore,us,,10.0,0.0,,,,,10.0,,
satchels bags for school,us,,10.0,0.09,,,,,10.0,,
school bags for toddlers online,us,,10.0,0.0,,,,,10.0,,
school bags for school,us,,10.0,,,,,,40.0,,
game school bags,us,,10.0,,,,,,400.0,,
school bags for 8 years old girl,us,,10.0,,,,,,60.0,,
school bags with secret pockets,us,,10.0,,,,,,60.0,,
xiaomei school bags,us,,10.0,0.0,,,,,10.0,,
school bags companies in india,us,,10.0,0.0,,,,,10.0,,
children school bags online,us,,10.0,0.0,,,,,10.0,,
school book bags teenage girls,us,,10.0,0.0,,,,,10.0,,
laptop school bags,us,,10.0,,,,,,60.0,,
school fundraiser reusable bags,us,,10.0,0.0,,,,,10.0,,
nike bags for girls school,us,,10.0,0.0,,,,,10.0,,
ebay bags school,us,,10.0,0.0,,,,,10.0,,
school messenger bags for teens,us,,10.0,0.0,,,,,10.0,,
samsonite school bags with wheels,us,,10.0,,,,,,50.0,,
leather messenger school bags,us,,10.0,1.6,,,,,10.0,,
school bags for 6th class girl,us,,10.0,,,,,,200.0,,
personalized messenger bags for school,us,,10.0,,,,,,50.0,,
how to make valentine bags for school,us,,10.0,,,,,,10.0,,
school bags nz,us,,10.0,,,,,,1000.0,,
school girls bags,us,,10.0,,,,,,100.0,,
old navy school bags sale,us,,10.0,0.0,,,,,10.0,,
aztec school bags,us,,10.0,0.0,,,,,10.0,,
middle school messenger bags,us,,10.0,1.5,,,,,10.0,,
school bags in bangkok,us,,10.0,0.0,,,,,10.0,,
one direction school book bags,us,,10.0,0.0,,,,,10.0,,
school bags advertisement,us,,10.0,0.0,,,,,10.0,,
para john school bags,us,,10.0,0.0,,,,,10.0,,
all types of school bags,us,,10.0,,,,,,60.0,,
strawberry shortcake bags and school supplies,us,0.0,10.0,1.3,,,,,20.0,,
school tote bags for teens,us,,10.0,0.3,,,,,10.0,,
lotto school bags,us,,10.0,0.0,,,,,10.0,,
roxy messenger bags for school,us,0.0,10.0,0.7,,roxy messenger bag,########,"Thumbnail,Image pack,Shopping results",30.0,0.0,
school bags for kids rolling,us,,10.0,0.0,,,,,10.0,,
minecraft school bags uk,us,,10.0,0.0,,,,,10.0,,
latest school bags for kids,us,,10.0,0.6,,,,,10.0,,
sports school bags,us,,10.0,,,,,,60.0,,
old navy school bags,us,,10.0,,,,,,20.0,,
school bags for secondary school,us,,10.0,,,,,,600.0,,
pics of jansport school bags,us,,10.0,0.0,,,,,10.0,,
personalised book bags school,us,,10.0,0.0,,,,,10.0,,
konga school bags,us,,10.0,0.0,,,,,20.0,,
women school bags,us,7.0,10.0,,,,,,40.0,,
trending school bags,us,,10.0,,,,,,250.0,,
school bags online south africa,us,,10.0,0.0,,,,,10.0,,
j d sports school bags,us,,10.0,0.0,,,,,10.0,,
extra large tote bags school,us,,10.0,0.0,,,,,10.0,,
cool school bags australia,us,,10.0,0.0,,,,,10.0,,
pretty school bags uk,us,,10.0,0.0,,,,,10.0,,
staples school bags canada,us,,10.0,0.15,,,,,10.0,,
school bags for girls disney,us,,10.0,0.0,,,,,10.0,,
swag bags for school,us,,10.0,0.0,,,,,10.0,,
new york school bags,us,,10.0,0.0,,,,,10.0,,
walmart book bags school,us,,10.0,0.0,,,,,10.0,,
trolley bags for school online,us,,10.0,0.0,,,,,10.0,,
fashionable bags for high school,us,,10.0,0.0,,,,,10.0,,
back to school treat bags for students,us,,10.0,,,,,,10.0,,
junior school bags,us,,10.0,,,,,,100.0,,
bags for law school,us,,10.0,,,,,,20.0,,
beautiful school bags,us,,10.0,,,,,,150.0,,
best bags for high school,us,,10.0,,,,,,30.0,,
cool side bags for school,us,,10.0,0.0,,,,,10.0,,
school bags online for boys,us,,10.0,0.0,,,,,50.0,,
tote bags for school forever 21,us,,10.0,0.9,,,,,20.0,,
what tote bags are good for school,us,,10.0,1.0,,,,,10.0,,
man city school bags,us,,10.0,0.0,,,,,10.0,,
shoulder school bags for teens,us,,10.0,0.0,,,,,10.0,,
new holland tractor school bags,us,,10.0,0.0,,,,,10.0,,
chota bheem school bags,us,,10.0,0.0,,,,,100.0,,
crossbody school bags for girls,us,,10.0,0.35,,,,,20.0,,
transparent school bags,us,,10.0,,,,,,30.0,,
vintage bags for school,us,,10.0,,,,,,60.0,,
girls character school bags,us,,10.0,,,,,,40.0,,
leather bags for school,us,,10.0,,,,,,70.0,,
school book bags 2014,us,,10.0,0.0,,,,,10.0,,
adidas school bags price in india,us,,10.0,0.0,,adidas bags online,,,20.0,,
body glove school bags,us,,10.0,0.0,,,,,10.0,,
girls school bags satchel,us,,10.0,0.0,,,,,20.0,,
mercury bay school bags,us,,10.0,0.0,,,,,10.0,,
back to school goodie bags for teachers,us,,10.0,,,,,,20.0,,
north face bags for school,us,,10.0,,,,,,20.0,,
animal brand school bags,us,,10.0,0.0,,,,,10.0,,
expensive school bags,us,,10.0,,,,,,100.0,,
name tags for school bags,us,,10.0,,,,,,60.0,,
girl book bags for school,us,,10.0,,,,,,10.0,,
floral messenger bags for school,us,,10.0,0.01,,,,,10.0,,
hype school bags ebay,us,,10.0,0.0,,,,,100.0,,
walmart messenger bags for school,us,,10.0,0.4,,,,,20.0,,
cute big tote bags for school,us,,10.0,0.0,,,,,20.0,,
the best school bags for college,us,,10.0,0.0,,,,,10.0,,
fashionable school bags 2014,us,,10.0,0.0,,,,,10.0,,
school bags college students,us,,10.0,1.7,,,,,10.0,,
angelina ballerina school bags,us,,10.0,0.0,,,,,10.0,,
older girls school bags,us,,10.0,,,,,,100.0,,
school bags with trolley online,us,,10.0,0.0,,,,,20.0,,
car shaped school bags,us,,10.0,0.0,,,,,10.0,,
school canada milk bags,us,,10.0,,,,,,10.0,,
school bags big,us,,10.0,,,,,,60.0,,
advertisement on school bags in hindi,us,,10.0,0.0,,,,,20.0,,
online school bags india,us,,10.0,0.0,,,,,10.0,,
school bags samsonite,us,,10.0,0.7,,samsonite backpack,,,20.0,,
cool school bags for teens,us,,10.0,0.0,,,,,50.0,,
where to find school bags,us,,10.0,0.0,,,,,10.0,,
canvas book bags for school,us,3.0,10.0,0.0,,canvas tote bags,########,"Shopping results,Thumbnail,People also ask,Image pack,Videos",10.0,6000.0,
cheap school lunch bags,us,,10.0,0.0,,,,,10.0,,
duckback school bags price,us,,10.0,0.0,,,,,10.0,,
leather school bags women,us,,10.0,0.0,,,,,10.0,,
german school bags,us,,10.0,,,,,,50.0,,
side tote bags for school,us,,10.0,,,,,,10.0,,
reading bags for school,us,,10.0,,,,,,20.0,,
school laptop bags,us,,10.0,,,,,,70.0,,
large totes bags for school,us,,10.0,0.0,,,,,10.0,,
womens school shoulder bags,us,,10.0,0.0,,,,,10.0,,
wholesale school bags in usa,us,,10.0,0.0,,,,,10.0,,
womens bags for school,us,,10.0,0.0,,,,,10.0,,
power rangers school bags in india,us,,10.0,0.0,,,,,10.0,,
school bags for kids philippines,us,,10.0,0.0,,,,,10.0,,
mens shoulder bags for school,us,,10.0,0.0,,,,,20.0,,
kids school bags for sale,us,,10.0,0.8,,,,,10.0,,
canvas school bags online india,us,,10.0,0.0,,,,,10.0,,
black nike school bags,us,,10.0,,,,,,150.0,,
school bags for teen girls,us,,10.0,,,,,,100.0,,
images of nike school bags,us,,10.0,0.0,,,,,10.0,,
hello kitty school bags india,us,,10.0,0.0,,,,,10.0,,
cross school bags,us,,10.0,0.0,,,,,10.0,,
band bags for school,us,,10.0,0.0,,,,,10.0,,
jashanmal school bags,us,,10.0,0.0,,,,,10.0,,
cool school bags for sale,us,,10.0,0.0,,,,,10.0,,
cross body bags for high school,us,,10.0,0.8,,,,,10.0,,
plain messenger bags for school,us,,10.0,0.0,,,,,10.0,,
nike girl school bags,us,,10.0,0.0,,,,,10.0,,
flower print school bags,us,,10.0,0.0,,,,,10.0,,
buy boys school bags,us,,10.0,,,,,,30.0,,
totto bags for school,us,,10.0,0.01,,,,,10.0,,
teenage school bags ebay,us,,10.0,0.0,,,,,10.0,,
school bags australia,us,,10.0,,,,,,250.0,,
big school bags online,us,,10.0,0.0,,,,,20.0,,
character school bags ireland,us,,10.0,0.0,,,,,10.0,,
nike book bags school,us,,10.0,0.0,,,,,10.0,,
cheap school satchel bags,us,,10.0,0.0,,,,,10.0,,
vintage messenger bags for school,us,0.0,10.0,0.7,,vintage messenger bag,########,"Thumbnail,Shopping results,Discussions,People also ask,Image pack",20.0,150.0,
cath kidston school bags amazon,us,,10.0,0.0,,,,,10.0,,
school bags in india,us,,10.0,,,,,,50.0,,
school bags shop near me,us,,10.0,,,,,,600.0,,
best bags for nursing school,us,,10.0,,,,,,10.0,,
nice tote bags for school,us,,10.0,,,,,,20.0,,
fcb school bags,us,,10.0,0.0,,,,,10.0,,
white book bags for school,us,0.0,10.0,0.0,,white backpack,########,"Thumbnail,People also ask,Shopping results,Image pack",20.0,900.0,
vans bags school,us,,10.0,0.0,,,,,10.0,,
high school musical goody bags,us,,10.0,0.0,,,,,10.0,,
personalized bags for school,us,,10.0,1.6,,,,,10.0,,
tote school bags for girls,us,,10.0,0.0,,,,,10.0,,
valentines goodie bags for school,us,,10.0,,,,,,10.0,,
trolley school bags for kids philippines,us,,10.0,0.0,,,,,10.0,,
adidas side bags school,us,,10.0,1.2,,adidas shoulder bag,,,40.0,,
hot wheels school bags,us,,10.0,0.4,,,,,10.0,,
girl teenage school bags,us,,10.0,1.7,,,,,10.0,,
duck dynasty school bags,us,,10.0,0.0,,,,,10.0,,
jansport school bags ireland,us,,10.0,,,,,,100.0,,
preppy school bags,us,,10.0,,,,,,90.0,,
ideas for back to school goodie bags,us,,10.0,,,,,,10.0,,
school bags for boy,us,,10.0,,,,,,150.0,,
school caddy bags,us,,10.0,0.0,,,,,20.0,,
mesh bags for school,us,,10.0,,,,,,10.0,,
coach book bags for school,us,,10.0,0.0,,,,,10.0,,
school bags wallpaper,us,,10.0,0.0,,,,,20.0,,
buy wildcraft school bags online,us,,10.0,0.0,,,,,10.0,,
river island school bags,us,,10.0,,,,,,900.0,,
canvas school bags online,us,,10.0,0.1,,,,,30.0,,
skelanimals school bags,us,,10.0,0.0,,,,,10.0,,
totem school bags,us,,10.0,,,,,,2200.0,,
new adidas school bags,us,,10.0,,,,,,80.0,,
what are japanese school bags called,us,7.0,10.0,,,randoseru,########,"Featured snippet,Thumbnail,People also ask",40.0,350.0,
school sleeping bags,us,,10.0,1.0,,,,,10.0,,
city beach online school bags,us,,10.0,0.0,,,,,10.0,,
high sierra school bags india,us,,10.0,0.0,,,,,10.0,,
cool school bags online,us,,10.0,0.0,,,,,20.0,,
school trolley bags,us,,10.0,,,,,,700.0,,
monster university school bags,us,,10.0,0.0,,,,,10.0,,
valentine treat bags for school,us,,10.0,,,,,,10.0,,
nice shoulder bags for school,us,,10.0,,,,,,50.0,,
pna school bags,us,,10.0,,,,,,800.0,,
kids back to school bags,us,,10.0,,,,,,40.0,,
cheap tote bags for school,us,,10.0,,,,,,20.0,,
trolley school bags for kids,us,,10.0,,,,,,600.0,,
kids trolley school bags,us,,10.0,0.0,,,,,20.0,,
ebay childrens school bags,us,,10.0,0.0,,,,,10.0,,
funky fish school bags,us,,10.0,0.0,,,,,10.0,,
vintage school bags for girls,us,,10.0,0.15,,,,,10.0,,
cute gym bags for school,us,,10.0,0.4,,,,,20.0,,
school bags for 7 year olds,us,,10.0,0.0,,,,,10.0,,
supernatural school bags,us,,10.0,0.0,,,,,10.0,,
school bags 2015 for girls,us,,10.0,0.0,,,,,10.0,,
joules school bags,us,,10.0,,,,,,10.0,,
city beach school bags,us,,10.0,,,,,,100.0,,
large school bags ireland,us,,10.0,0.0,,,,,20.0,,
walmart school bags for boys,us,,10.0,0.02,,,,,10.0,,
racoon school bags,us,,10.0,0.0,,,,,10.0,,
stylish school bags for teenagers,us,,10.0,0.0,,,,,40.0,,
good messenger bags for high school,us,,10.0,0.0,,,,,10.0,,
adidas school bags online in india,us,,10.0,0.0,,,,,10.0,,
school book bags for teens,us,,10.0,0.0,,,,,10.0,,
room seven school bags,us,,10.0,0.0,,,,,10.0,,
orthopedic school bags south africa,us,,10.0,,,,,,70.0,,
school bags for college girls,us,,10.0,,,,,,30.0,,
school hand bags,us,,10.0,,,,,,250.0,,
women's bags for school,us,,10.0,,,,,,20.0,,
roller school bags,us,,10.0,,,,,,50.0,,
school bags women,us,,10.0,,,,,,40.0,,
adult school bags,us,,10.0,,,,,,20.0,,
trending elementry boys school bags 2018,us,,,0.0,,,,,,,
skybags school bags for boys,us,,,,,,,,70.0,,
adidas originals school bags,us,,,,,,,,10.0,,
hype school bags jd,us,,,0.0,,,,,30.0,,
school bags with hidden pockets,us,,,,,,,,30.0,,
school bags for boys 2nd grade,us,,,0.0,,,,,,,
treat bags for school valentines day,us,,,0.0,,,,,,,
seven school bags,us,,,0.0,,,,,10.0,,
short back to school poems for goodie bags,us,,,0.0,,,,,,,
school bags argos,us,,,,,,,,60.0,,
tote style school bags,us,,,,,,,,,,
school bags that aren't backpacks,us,,,,,,,,10.0,,
school bags manufacturing in chennai,us,,,,,,,,10.0,,
hooks to hang school bags,us,,,,,,,,20.0,,
school bags for girls and boys,us,,,,,,,,20.0,,
purple black school bags for girls,us,,,,,,,,200.0,,
nike bags for school girl,us,,,,,,,,300.0,,
school and college bags,us,,,,,,,,40.0,,
nike school bags sports direct,us,,,,,,,,,,
school nike elite bags,us,,,,,,,,,,
milk bags at school,us,,,,,,,,,,
soviet school bags,us,,,,,,,,150.0,,
the best school bags,us,,,,,,,,20.0,,
asking for donations of school bags for children letter,us,,,0.0,,,,,,,
danime school bags,us,,,,,,,,,,
messenger/laptop bags for teenage girls for high school with waterbottle holder,us,,,0.0,,,,,,,
fortnite school bags,us,,,,,,,,50.0,,
pe bags for secondary school,us,,,,,,,,40.0,,
argos school bags,us,,,,,,,,800.0,,
pink girls school bags,us,,,,,,,,20.0,,
matching school bags,us,,,,,,,,,,
personalized cheap tote bags for school,us,,,,,,,,,,
toddler school bags boy,us,,,,,,,,10.0,,
4 materials used to make school bags,us,,,,,,,,10.0,,
big w school bags,us,,,,,,,,800.0,,
images of school bags,us,,,,,,,,30.0,,
school bags for kid boy,us,,,,,,,,20.0,,
safari school bags price,us,,,,,,,,350.0,,
school bags nike and adidas,us,,,,,,,,50.0,,
leather school bags for men,us,,,,,,,,30.0,,
tote bags for work and school,us,,,0.0,,,,,,,
fuzzy school supply bags,us,,,0.0,,,,,,,
top quality school bags,us,,,,,,,,,,
back to school chip bags,us,,,,,,,,,,
very nice bags for school,us,,,0.0,,,,,,,
unicorn backpack school bags for girls,us,,,,,,,,20.0,,
girls' nike school bags,us,,,,,,,,10.0,,
kids school bags usa,us,,,0.0,,,,,10.0,,
unicef school bags,us,,,,,,,,20.0,,
md school crisis bags,us,,,0.0,,,,,,,
fashion tote bags for school,us,,,,,,,,,,
school bags black friday,us,,,,,,,,10.0,,
school bags harry potter,us,,,,,,,,20.0,,
school bags year 8,us,,,,,,,,,,
trolley school bags for boy,us,,,,,,,,250.0,,
cna school bags,us,,,,,,,,50.0,,
school bags under 600,us,,,,,,,,70.0,,
school bags for 13 year old boy,us,,,,,,,,10.0,,
school bags for 11 year olds,us,,,,,,,,30.0,,
arctic fox school bags,us,,,,,,,,60.0,,
buy online school bags for girls,us,,,0.0,,,,,,,
easter treats bags for school printables,us,,,0.0,,,,,,,
kipling school bags online,us,,,0.0,,,,,,,
school bags in uganda,us,,,,,,,,100.0,,
sporthouse school bags,us,,,,,,,,80.0,,
school bags leather,us,,,,,,,,80.0,,
gap school bags in india,us,,,0.0,,,,,,,
spirit school bags,us,,,0.0,,,,,,,
puma school bags online,us,,,0.0,,bags puma,,,10.0,,
elegant school bags,us,,,,,,,,20.0,,
school bags in lahore,us,,,,,,,,100.0,,
hot cheetos bags old school,us,,,0.0,,,,,,,
school bags new,us,,,,,,,,20.0,,
school bags for toddler boys,us,,,,,,,,20.0,,
school bags personalised,us,,,,,,,,20.0,,
school bags with lots of space,us,,,,,,,,10.0,,
school pump bags,us,,,,,,,,,,
plastic school book bags,us,,,,,,,,20.0,,
girls back to school bags,us,,,,,,,,30.0,,
teenage girl japanese tote bags for school,us,,,0.0,,,,,,,
school bags 2015 for men,us,,,0.0,,,,,,,
amazon bags for school,us,,,,,,,,,,
westfields sports.high school bags,us,,,0.0,,,,,,,
walmart book bags for school in the store,us,,,0.0,,,,,,,
strong tote bags for school,us,,,,,,,,10.0,,
broward county school clear bags,us,,,,,,,,,,
school bags in costco,us,,,,,,,,,,
school bags stylish,us,,,,,,,,30.0,,
shoe zone school bags,us,,,,,,,,40.0,,
black school bags jansport,us,,,,,,,,,,
fashion bags for school,us,,,,,,,,10.0,,
girls' cute bags for school,us,,,,,,,,10.0,,
adidas school bags for girl,us,,,,,,,,10.0,,
bags for high school boys,us,,,,,,,,,,
big school bags for high school,us,,,,,,,,40.0,,
easons school bags,us,,,,,,,,70.0,,
bags for high school boy,us,,,,,,,,10.0,,
takealot school bags,us,,,,,,,,800.0,,
golf bags for high school teams,us,,,,,,,,,,
online school bags for girl,us,,,,,,,,10.0,,
ben 10 school bags,us,,,,,,,,30.0,,
school bags set,us,,,,,,,,50.0,,
toddlers school bags,us,,,,,,,,20.0,,
best deals on school bags,us,,,0.0,,,,,10.0,,
boomerang school bags makro,us,,,,,,,,600.0,,
messenger bags for school for girl,us,,,0.0,,,,,,,
girls' book bags for high school,us,,,,,,,,,,
school bags ebay,us,,,,,,,,10.0,,
school bags philippines,us,,,,,,,,30.0,,
stylish school bags for college students,us,,,,,,,,20.0,,
are school bags allowed in msg?,us,,,0.0,,,,,,,
kanken school bags,us,,,,,,,,10.0,,
school bags for 13 year olds,us,,,,,,,,10.0,,
school bags good quality,us,,,,,,,,30.0,,
nike kids school bags,us,,,,,,,,10.0,,
pre school bags,us,,,,,,,,80.0,,
school emergency bags,us,,,,,,,,,,
decathlon school bags,us,,,,,,,,300.0,,
school bags in japan,us,,,,,,,,10.0,,
girl bags school,us,,,,,,,,40.0,,
best school bags for teenage girls,us,,,0.0,,,,,10.0,,
inspirational school bags on amazon,us,,,0.0,,,,,,,
school bags at ross department store,us,,,0.0,,,,,,,
girls high school bags,us,,,,,,,,60.0,,
sky bags for school,us,,,,,,,,350.0,,
smiggle school bags and lunch box,us,,,,,,,,30.0,,
school bans bags,us,,,,,,,,20.0,,
pastel bags for school,us,,,,,,,,,,
girly bags for school,us,,,,,,,,10.0,,
elementary school bags,us,,,,,,,,10.0,,
personalized school bags for toddlers,us,,,,,,,,30.0,,
school kipling bags,us,,,,,,,,20.0,,
pull school bags,us,,,,,,,,20.0,,
women bags for school,us,,,,,,,,10.0,,
school bags london,us,,,,,,,,40.0,,
naruto school bags,us,,,,,,,,30.0,,
kappa school bags,us,,,,,,,,200.0,,
welcome back to school gift bags for students,us,,,,,,,,,,
kids rolling backpack girls roller school bag student luggage book bags,us,,,,,,,,,,
boys bags for school,us,4.0,,,,kids backpacks,,,80.0,,
kipling school bags sale,us,,,,,,,,20.0,,
what kind of school bags do korean kids us,us,,,0.0,,,,,,,
school bags offer price,us,,,0.0,,,,,10.0,,
ted baker school bags,us,,,,,,,,30.0,,
back bags for school,us,8.0,,,,school backpacks,,,,,
cute school book bags,us,,,,,,,,,,
bargain hunt school bags,us,,,0.0,,,,,,,
jansport school bags india,us,,,0.0,,,,,,,
sainsbury school bags,us,,,0.0,,,,,10.0,,
tiffin bags for school,us,,,,,,,,40.0,,
book bags for high school students,us,,,,,,,,,,
school book bags wholesale,us,,,,,,,,,,
