Keyword,Country,Difficulty,Volume,CPC,CPS,Parent Keyword,Last Update,SERP Features,Global volume,Traffic potential,First seen
waterproof backpack black school bags for girls,us,,,,,,,,200.0,,
american tourister school bags for girls,us,,,,,,,,60.0,,
heyfair women funny fruits casual canvas school college backpack cute bags daypack,us,,,0.0,,,,,,,
blue puma school bags,us,,,,,,,,150.0,,
kids bags for school,us,,,,,,,,40.0,,
book bags for high school boys,us,,,,,,,,,,
bags for school black,us,,,,,,,,40.0,,
cheap school bags for sale,us,,,,,,,,10.0,,
grad school bags,us,,,,,,,,,,
school bags design,us,,,,,,,,100.0,,
adidas school bags amazon,us,,,,,,,,,,
awesome school bags,us,,,,,,,,50.0,,
dc school bags,us,,,,,,,,,,
recycled school bags,us,,,,,,,,20.0,,
school bags for tweens,us,,,,,,,,10.0,,
smiggle school bags sale,us,,,,,,,,50.0,,
school bags with wheels near me,us,,,,,,,,20.0,,
h&m school bags,us,,,,,,,,20.0,,
louis vuitton school bags,us,,,,,,,,250.0,,
photos of school bags,us,,,,,,,,,,
barbie school bags with trolley,us,,,,,,,,40.0,,
target school bags australia,us,,,0.0,,,,,,,
school bags branded,us,,,,,,,,70.0,,
hard wearing school bags,us,,,,,,,,,,
hurley school bags,us,,,,,,,,20.0,,
kids messenger bags for school,us,,,,,,,,10.0,,
ackermans school bags,us,,,,,,,,250.0,,
are tote bags allowed in school,us,,,,,,,,,,
school bags for kids with wheels,us,,,,,school bag,,,10.0,,
school tommy hilfiger bags,us,,,,,,,,20.0,,
cute small school bags,us,,,,,,,,10.0,,
pakistani school bags,us,,,,,,,,20.0,,
sale school bags,us,,,,,,,,10.0,,
nike school bags sale,us,,,,,,,,10.0,,
where can i buy red mountain school bags,us,,,0.0,,,,,30.0,,
old style school bags,us,,,,,,,,20.0,,
nike school bags at studio 88,us,,,,,,,,60.0,,
book bags for school for kids,us,,,,,,,,,,
types of school bags with names,us,,,,,,,,50.0,,
school big bags,us,,,,,,,,10.0,,
school bags images,us,,,,,,,,150.0,,
ladies school bags online,us,,,0.0,,,,,,,
designer school tote bags,us,,,,,,,,,,
tesla logo school book bags starry sky backpacks travel daypack bags ,us,,,0.0,,,,,,,
goodie bags for first day of school,us,,,,,,,,,,
mickey mouse school bags,us,,,,,,,,20.0,,
school bags cute,us,,,,,,,,50.0,,
genie bags for school,us,,,,,,,,600.0,,
school bags for girls india,us,,,,,,,,20.0,,
school bags for 11 years old girl,us,,,,,,,,20.0,,
unicorn school bags for girls,us,,,,,,,,50.0,,
nylon school bags,us,,,,,,,,20.0,,
school bags youtubers,us,,,0.0,,,,,,,
khadi school bags,us,,,0.0,,,,,,,
best lunch bags for high school,us,,,,,,,,,,
private school bags,us,,,,,,,,10.0,,
frozen bags for school,us,,,,,,,,30.0,,
storage for school bags,us,,,,,,,,70.0,,
cute school bags australia,us,,,0.0,,,,,10.0,,
school bags for primary school,us,,,,,,,,150.0,,
why school bags are provided with wide straps,us,,,,,,,,,,
horse school bags,us,,,,,,,,20.0,,
best school bags for 4 year olds,us,,,,,,,,,,
school wheelie bags,us,,,,,,,,20.0,,
leather bags school,us,,,,,,,,20.0,,
river island bags for school,us,,,,,,,,400.0,,
bags to get for school,us,,,,,,,,,,
packed lunch bags for school,us,,,,,,,,40.0,,
first day of school goodie bags for students,us,,,,,,,,,,
school bags for girls with wheels,us,,,,,,,,60.0,,
sunday school goodie bags,us,,,,,,,,,,
1980 school bags,us,,,,,,,,50.0,,
uni school bags,us,,,,,,,,10.0,,
wheeled book bags school,us,4.0,,0.8,,rolling backpacks for school,,,,,
wheels school bags,us,,,0.7,,,,,,,
stylish casual comfort college on sale back to school hot deal pc couple korean bags backpack,us,,,0.0,,,,,,,
shoulder school bags for girls,us,,,,,,,,30.0,,
large messenger bags for school,us,,,,,,,,10.0,,
nike school bags for girl,us,,,,,,,,20.0,,
printed canvas school bags,us,,,0.0,,,,,,,
black pink black school bags for girls,us,,,,,,,,30.0,,
black school bags for high school,us,,,,,,,,20.0,,
small milk bags school,us,,,,,,,,10.0,,
american tourister school bags price in india,us,,,,,,,,20.0,,
cute book bags for middle school,us,,,,,,,,,,
school book bags near me,us,,,,,,,,,,
total sports school bags prices,us,,,,,,,,200.0,,
chair bags for school price,us,,,,,,,,20.0,,
jd bags for school,us,,,,,,,,100.0,,
fabric school bags,us,,,,,,,,10.0,,
popular bags for school,us,7.0,,,,cute teen girl backpacks,,,10.0,,
school bags price in india,us,,,,,,,,10.0,,
asian school bags,us,0.0,,,,korean shoes,,,,,
roxy satchel school bags,us,,,0.0,,,,,10.0,,
smiggle school bags nz,us,,,,,,,,50.0,,
girls' school bags for kids,us,,,,,,,,10.0,,
storage ideas for school bags,us,,,,,,,,20.0,,
school bags at ross dress for less,us,,,0.0,,,,,,,
school sports bags uk,us,,,0.0,,,,,,,
waterproof school bags for girls,us,,,,,,,,70.0,,
spider man school bags,us,,,,,,,,30.0,,
sm school bags,us,,,,,,,,80.0,,
classy school bags,us,,,,,,,,30.0,,
second hand school bags for sale,us,0.0,,,,used school bags wholesale,,,20.0,,
skybags school bags under 500,us,,,,,,,,40.0,,
trolley bags school,us,,,,,,,,150.0,,
british school bags,us,,,,,,,,10.0,,
cute black school bags,us,,,,,,,,40.0,,
school bags dubai,us,,,,,,,,50.0,,
school bags brand name,us,,,,,,,,50.0,,
school bags trendy,us,,,,,,,,10.0,,
bags for nursery school,us,,,,,,,,10.0,,
kawaii backpack cute bags for girls for school,us,,,,,,,,100.0,,
classic school bags,us,,,,,,,,50.0,,
yellow school bags,us,,,,,,,,30.0,,
bags back to school,us,,,,,,,,10.0,,
bags for high school girls,us,,,,,,,,10.0,,
wiki school bags,us,,,,,,,,300.0,,
name types of school bags,us,,,,,,,,50.0,,
ransel randoseru upscale prince princess japanese school bags for girls,us,,,0.0,,,,,,,
school bags at target,us,,,,,,,,,,
footlocker school bags,us,,,,,,,,10.0,,
eco friendly school bags,us,,,,,,,,50.0,,
school bags for girls skybags,us,,,,,,,,10.0,,
big hand bags for school,us,,,,,,,,,,
halloween treat bags for school ideas,us,,,,,,,,,,
back to school fashion bags,us,,,,,,,,,,
school bags 40 litres,us,,,,,,,,50.0,,
school bags for 6 year old boy,us,,,,,,,,50.0,,
puma school bags price,us,,,,,,,,250.0,,
university school bags,us,,,,,,,,10.0,,
little bags for school,us,,,,,,,,,,
dior school bags,us,,,,,,,,30.0,,
school bans bags so boy carries microwave,us,,,0.0,,,,,,,
school bags for high school girls,us,,,,,,,,30.0,,
vans disney school bags,us,,,0.0,,,,,,,
purple genie school bags,us,,,,,,,,400.0,,
custom made school bags,us,,,,,,,,10.0,,
treat bags for school birthday,us,,,,,,,,,,
1990 school bags,us,,,,,,,,60.0,,
can you put school bags in the washing machine,us,,,,,,,,10.0,,
wheeled school bags uk,us,,,,,roll away book bags,,,10.0,,
the fairly oddparents school bags,us,,,0.0,,,,,,,
trend school bags,us,,,,,,,,10.0,,
bags of milk in elementary school,us,,,,,,,,,,
girls bags for high school,us,,,,,,,,,,
safari bags school,us,,,,,,,,1000.0,,
good back to school bags,us,,,,,,,,,,
who is giving away free book bags for school this year,us,,,0.0,,,,,,,
how to store school bags,us,,,,,,,,50.0,,
book bags for school nike,us,,,,,,,,,,
orleans parish elementary schools school bags,us,,,,,,,,,,
guess bags for school,us,,,0.0,,,,,,,
liberty school bags,us,,,,,,,,50.0,,
personalised bags for school,us,,,0.0,,,,,10.0,,
name bran ziploc bags for school supplies,us,,,0.0,,,,,,,
buy nike school bags online,us,,,0.0,,,,,20.0,,
hype school bags amazon,us,,,0.0,,,,,60.0,,
teenage school bags girls,us,,,0.0,,,,,20.0,,
redbat school bags price,us,,,,,,,,300.0,,
adidas school bags nz,us,,,,,,,,10.0,,
nike air bags for school,us,,,,,,,,50.0,,
chic school bags,us,,,,,,,,,,
school bus goodie bags,us,,,,,,,,,,
cat bags for school,us,,,,,,,,70.0,,
best school bags for elementary,us,,,,,,,,,,
used school bags,us,,,,,,,,10.0,,
dakine school bags,us,,,,,,,,10.0,,
boomerang school bags south africa,us,,,,,,,,70.0,,
nike school bags for men,us,,,,,,,,,,
welcome to sunday school bags,us,,,0.0,,,,,,,
glitter school bags,us,,,,,,,,,,
"bold, graphic design, glitter messenger bags school",us,,,0.0,,,,,,,
plastic school bags,us,,,,,,,,40.0,,
milk bags school meme,us,,,0.0,,,,,,,
fuel school bags,us,,,,,,,,10.0,,
school bags for boys and girls,us,,,,,,,,20.0,,
van school bags,us,,,,,,,,30.0,,
girls satchel school bags,us,,,,,,,,10.0,,
school bags clearance,us,,,,,,,,,,
jd school bags,us,,,,,,,,600.0,,
high school girl tote bags,us,,,,,,,,,,
best back to school bags,us,,,,,,,,,,
temu school bags,us,,,,,,,,20.0,,
trending school bags 2023,us,,,,,,,,50.0,,
school lunch bags uk,us,,,,,,,,,,
conceiled school bags,us,,,0.0,,,,,,,
accessories school bags,us,,,0.0,,,,,,,
eminem school bags,us,,,0.0,,,,,10.0,,
school bags for heavy books,us,,,,,,,,10.0,,
how to keep school bags at home,us,,,,,,,,30.0,,
places to buy school bags,us,,,,,,,,10.0,,
amazon school bags sale,us,,,0.0,,,,,,,
school bags shoulder bags,us,,,0.0,,,,,,,
school bags flipkart,us,,,,,,,,20.0,,
cheap kipling school bags,us,,,0.0,,,,,10.0,,
flying machine school bags,us,,,,,,,,10.0,,
school bags for girls black,us,,,,,,,,300.0,,
ralph lauren school bags,us,,,,,,,,20.0,,
ways to store school bags,us,,,,,,,,10.0,,
large satchel school bags,us,,,,,,,,,,
louis vuitton bags for school,us,,,,,,,,20.0,,
school bags puma,us,,,,,,,,90.0,,
skybags school bags with rain cover,us,,,,,,,,90.0,,
tommy hilfiger bags for school,us,,,,,,,,10.0,,
secondary school bags boys,us,,,,,,,,10.0,,
school tote bags for girls,us,,,,,,,,10.0,,
personalised school lunch bags,us,,,,,,,,,,
tote bags for school books,us,,,,,,,,,,
typo school bags,us,,,,,,,,90.0,,
hello kitty school bags in dubai,us,,,,,,,,10.0,,
school bags offers online,us,,,0.0,,,,,20.0,,
stitch school bags,us,,,,,,,,250.0,,
school bags for college boy,us,,,,,,,,20.0,,
cute small bags for school,us,,,,,,,,10.0,,
puma bags for school,us,,,,,bags puma,,,250.0,,
kyrie irving school bags,us,,,0.0,,,,,,,
bags for men school,us,,,,,,,,50.0,,
bags for school near me,us,,,,,,,,,,
aesthetic tote bags for school,us,,,,,,,,20.0,,
school bags from skybags,us,,,,,,,,20.0,,
jordan school bags price,us,,,,,,,,70.0,,
coolest school bags,us,,,,,best looking backpacks,,,20.0,,
kocotree school bags review,us,,,,,,,,40.0,,
school bags with dividers,us,,,,,,,,30.0,,
show me school bags,us,,,,,,,,30.0,,
lol bags for school,us,,,,,,,,60.0,,
cute clear bags for school,us,,,,,,,,,,
totto school bags with wheels,us,,,,,,,,20.0,,
what material is used for school bags,us,,,,,,,,30.0,,
preschool school bags,us,,,,,,,,40.0,,
school christmas goodie bags,us,,,,,,,,,,
american tourister school bags with rain cover,us,,,,,,,,250.0,,
"""""""school bags""""""",us,,,,,,,,10.0,,
how many school bags are there,us,,,,,,,,60.0,,
school bags are made up of,us,,,0.0,,,,,20.0,,
best place to buy school bags,us,,,,,,,,30.0,,
branded school bags deals,us,,,0.0,,,,,,,
genie:w8adjtk3ltk= black school bags for girls,us,,,,,,,,10.0,,
plastic bags for school,us,,,,,,,,,,
school canvas bags,us,,,,,,,,,,
buy school bags teen,us,,,0.0,,,,,,,
school bags manufacturers in india,us,,,,,,,,20.0,,
book bags for school with lunch box,us,,,,,,,,,,
bags for school teachers,us,,,,,,,,40.0,,
bags for women for school,us,,,,,,,,10.0,,
one strap bags for school,us,,,,,,,,,,
vans school bags for boys,us,,,0.0,,,,,,,
normal school bags,us,,,,,,,,20.0,,
welcome back to school bags,us,,,,,,,,,,
dkny school bags,us,,,,,,,,20.0,,
school bags for little girls,us,,,,,,,,20.0,,
ware county school book bags,us,,,0.0,,,,,,,
kipling school bags ebay,us,,,0.0,,,,,,,
bags of milk in school,us,,,,,,,,,,
library book bags for school,us,,,,,,,,20.0,,
backpacks and lunch bags for back to school,us,,,,,,,,,,
school book bags on sale,us,,,,,,,,,,
boy bags for school,us,,,,,,,,40.0,,
gym bags for school,us,,,,,,,,,,
vans school bags price,us,,,,,,,,50.0,,
old school satchel bags,us,,,,,,,,10.0,,
school bags grey,us,,,,,,,,10.0,,
best school bags with wheels,us,,,,,,,,,,
cute girl school bags,us,5.0,,,,,,,,,
school college bags,us,,,,,,,,50.0,,
black school bags for high school girls,us,,,0.0,,,,,20.0,,
liverpool school bags,us,,,,,,,,70.0,,
lunch bag water bottle school bags for girls,us,,,,,,,,,,
best school bags brands,us,,,,,,,,150.0,,
hallway storage for school bags,us,,,,,,,,10.0,,
primark school bags,us,,,,,,,,20.0,,
school bags for year 6,us,,,,,,,,30.0,,
cheap lunch bags for school,us,,,,,,,,,,
nike school bags price,us,,,,,,,,450.0,,
pna school bags prices,us,,,,,,,,350.0,,
wholesale school bags uk,us,,,,,,,,40.0,,
mini gucci school bags for boys,us,,,0.0,,,,,,,
bags of school,us,,,,,,,,50.0,,
jworld school bags,us,,,,,,,,40.0,,
last day of school treat bags,us,,,,,,,,,,
non food goody bags for school,us,,,0.0,,,,,,,
bags for girls for school,us,,,,,,,,100.0,,
anime bags for school,us,,,,,,,,40.0,,
school bags online india,us,,,,,,,,20.0,,
goodie bags for back to school,us,,,,,,,,,,
school bags boy,us,,,,,,,,70.0,,
bags for school for boys,us,,,,,,,,30.0,,
savvy school bags,us,,,,,,,,500.0,,
school bags usa,us,,,,,,,,20.0,,
jansport school bags for girls,us,,,,,,,,10.0,,
jansports school bags,us,,,,,jansport,,,,,
cheap and best school bags,us,,,0.0,,,,,,,
cheapest school bags,us,,,,,,,,80.0,,
school bags images with price,us,,,,,,,,60.0,,
girls school tote bags,us,,,,,,,,,,
adidas school bags price,us,,,,,,,,200.0,,
trashion show plastic bags recycled outfit ideas for school,us,,,,,,,,10.0,,
cr7 school bags,us,,,,,,,,20.0,,
can heavy school bags cause scoliosis,us,,,,,,,,,,
cotton school bags,us,,,,,,,,30.0,,
back to school shopping bags,us,,,,,,,,,,
cute high school bags,us,,,,,,,,,,
hefty school ziploc bags,us,,,0.0,,,,,,,
school bags 2024,us,,,,,,,,40.0,,
school bags teenage,us,,,,,,,,,,
redbat school bags,us,,,,,,,,2800.0,,
school messenger bags for girls,us,,,,,,,,,,
school crossbody bags,us,,,,,,,,10.0,,
top model school bags,us,,,,,,,,150.0,,
pink adidas school bags,us,,,,,,,,50.0,,
back to school bags for kids,us,,,,,,,,,,
book bags for school bulk,us,,,,,,,,,,
sportscene school bags,us,,,,,,,,500.0,,
school bags ,us,,,,,,,,10.0,,
school bags at macy's,us,,,0.0,,,,,,,
fun goody bags fir school,us,,,0.0,,,,,,,
shein bags for school,us,,,,,,,,20.0,,
valentines day treat bags for school,us,,,,,,,,,,
school bags in the 70s,us,,,,,,,,,,
pe bags for school,us,,,,,,,,350.0,,
school bags for 7 years old girl,us,,,,,,,,30.0,,
plain black school bags,us,,,,,,,,30.0,,
school bags cartoon,us,,,,,,,,50.0,,
quicksilver school bags,us,,,,,,,,70.0,,
school bags with wheels for boys,us,,,,,,,,10.0,,
floral vans school bags,us,,,,,,,,40.0,,
avengers school bags,us,,,,,,,,30.0,,
crossbody book bags for school,us,,,,,,,,,,
teenage girl messenger bags for school,us,,,0.0,,,,,,,
nike school bags in sri lanka,us,,,,,,,,10.0,,
alibaba school bags,us,,,,,,,,20.0,,
first day of school treat bags for students,us,,,,,,,,,,
trolley school bags near me,us,,,,,,,,40.0,,
how many school bags,us,,,,,,,,40.0,,
school bags collection,us,,,,,,,,30.0,,
school bags for boy price,us,,,0.0,,,,,60.0,,
gothic school bags,us,,,,,,,,20.0,,
back to school snack bags,us,,,,,,,,,,
school bags american tourister,us,,,,,,,,150.0,,
nike boys school bags,us,,,,,,,,10.0,,
captain america school bags,us,,,,,,,,10.0,,
school bags with secret compartment,us,,,,,,,,20.0,,
volcom school bags,us,,,,,,,,10.0,,
how to wash school bags,us,,,,,,,,10.0,,
school supplies bags,us,,,,,,,,10.0,,
kids medium school bags,us,,,,,,,,10.0,,
justice bags for school,us,,,,,,,,20.0,,
shop school bags,us,,,,,,,,10.0,,
highland school bags,us,,,0.0,,,,,10.0,,
back to school bags fashion,us,,,0.0,,,,,10.0,,
vintage school satchel bags,us,,,0.0,,,,,10.0,,
school bags for high school australia,us,,,,,,,,10.0,,
girls school book bags,us,,,,,,,,10.0,,
high school graduation goodie bags,us,,,,,,,,,,
boys' bags for school,us,,,,,,,,10.0,,
northface school bags,us,,,,,,,,10.0,,
shoulder bags for women school,us,,,,,,,,,,
men school bags,us,,,,,,,,20.0,,
bags on wheels for school,us,,,,,,,,10.0,,
school bus gift bags,us,,,,,,,,,,
clarks school bags,us,,,,,,,,30.0,,
college school bags fashion,us,,,,,purses for college students,,,,,
baby bags for school,us,,,,,,,,20.0,,
halloween goody bags for school,us,,,,,,,,,,
"best designer tote bags 2023 luxury bags for work, school and play, fits a laptop and more!",us,,,,,,,,,,
school supplies book bags,us,,,,,,,,,,
law school tote bags designer,us,,,0.0,,,,,,,
are messenger bags good for high school,us,,,,,,,,,,
nike elite school bags amazon,us,,,0.0,,,,,,,
jojo siwa girls backpack jojo school bags kids' backpacks (style b),us,,,0.0,,,,,,,
affordable school bags,us,,,,,,,,30.0,,
school bags for grade 7,us,,,,,,,,20.0,,
type of school bags,us,,,,,,,,50.0,,
hard case school bags,us,,,,,,,,10.0,,
school bags in dubai,us,,,,,,,,90.0,,
class 5 school bags for girls with price,us,,,,,,,,30.0,,
y2k bags for school,us,,,,,,,,10.0,,
smiggles school bags,us,,,,,,,,90.0,,
personalised school bags for toddlers,us,,,,,,,,30.0,,
school bags for girls kids,us,,,,,,,,70.0,,
school bags for toddler,us,,,,,,,,10.0,,
wall hooks for school bags,us,,,,,,,,10.0,,
school nike bags for men,us,,,,,,,,30.0,,
boys' nike school bags,us,,,,,,,,10.0,,
school bags unisex,us,,,,,,,,20.0,,
cheap school messenger bags,us,,,0.0,,,,,,,
school bags bags,us,,,0.0,,,,,,,
kids boys school bags,us,,,,,,,,20.0,,
army school bags,us,,,,,,,,20.0,,
school bags satchel,us,,,,,,,,10.0,,
school bags for girls pink,us,,,,,,,,20.0,,
large school satchel bags,us,,,0.0,,,,,,,
school trolley bags for girl,us,,,,,,,,70.0,,
fun goodie bags for school students,us,,,0.0,,,,,,,
fila school bags,us,,,,,,,,100.0,,
american tourister school bags on sale,us,,,0.0,,,,,,,
school bags for grade 1,us,,,,,,,,50.0,,
school bags with wheels for girls,us,,,,,,,,40.0,,
school bags anime,us,,,,,,,,10.0,,
cute lunch bags for high school,us,,,,,,,,,,
puma school bags for boys,us,,,,,,,,20.0,,
personalised school bags uk,us,,,,,,,,20.0,,
boys kids school bags,us,,,,,,,,,,
jordan bags for school,us,,,,,,,,50.0,,
luxury school bags for girls,us,,,,,,,,,,
high school band spirit bags,us,,,0.0,,,,,,,
book bags for school near me,us,,,,,,,,10.0,,
cute girls school bags,us,,,,,,,,,,
left shoulder school bags,us,,,0.0,,,,,,,
school bags for girls high school,us,,,,,,,,40.0,,
pokemon school bags online,us,,,0.0,,,,,10.0,,
big book bags for school,us,,,,,,,,,,
galaxy bags for school,us,,,,,,,,40.0,,
caribee school bags,us,,,,,,,,20.0,,
best school bags for primary school singapore,us,,,,,,,,40.0,,
sm trolley school bags price,us,,,,,,,,90.0,,
big school bags for girl,us,,,,,,,,20.0,,
g star raw school bags,us,,,,,,,,30.0,,
good quality school bags,us,,,,,,,,150.0,,
vector rainbow school bags,us,,,0.0,,,,,,,
princess school bags,us,,,,,,,,20.0,,
checkers school bags,us,,,,,,,,80.0,,
boho school bags,us,,,,,,,,,,
uk school bags,us,,,,,,,,50.0,,
dicks school bags,us,,,,,,,,,,
fluffy bags for school,us,,,,,,,,10.0,,
school bags for kids in india,us,,,,,,,,,,
nike jordan school bags,us,,,,,,,,40.0,,
school bags on sale in sams,us,,,0.0,,,,,,,
big shoulder bags for school,us,,,,,,,,,,
school bags offers,us,,,,,,,,70.0,,
best school bags for primary school nz,us,,,,,,,,20.0,,
school bags logo,us,,,,,,,,10.0,,
casual school bags,us,,,,,,,,40.0,,
school bags for primary 1,us,,,,,,,,30.0,,
school trolley bags for girl in india,us,,,,,,,,100.0,,
school trolley bags amazon,us,,,,,,,,20.0,,
used school bags in korea,us,,,,,,,,10.0,,
spiderman school bags,us,,,,,,,,70.0,,
nike adidas school bags for girls,us,,,,,,,,40.0,,
school bags pakistan,us,,,,,,,,100.0,,
armani school bags,us,,,,,,,,10.0,,
lock bags for cell phones at school,us,,,,,,,,,,
school trolley bags in qatar,us,,,0.0,,,,,20.0,,
warrant to search bags school,us,,,,,,,,,,
cartoon school bags,us,,,,,,,,30.0,,
best school bags for girls $,us,,,,,,,,10.0,,
4 year old school bags and snack bag set for girls,us,,,0.0,,,,,,,
effects of carrying heavy school bags,us,,,,,,,,20.0,,
end of school year goody bags,us,,,,,,,,,,
bulk book bags for school,us,,,,,,,,,,
ankara school bags,us,,,,,,,,40.0,,
small school bags for toddlers,us,,,,,,,,20.0,,
school bags flipkart girl,us,,,0.0,,,,,10.0,,
school bags year 7,us,,,,,,,,10.0,,
best nike bags for school,us,,,,,,,,10.0,,
college school bags for girls,us,,,,,,,,10.0,,
middle school goodie bags,us,,,,,,,,,,
teachers bags for school,us,,,,,,,,30.0,,
school bags jordan,us,,,,,,,,40.0,,
best bags for high school girl,us,,,,,,,,,,
why school bags are provided with broad straps,us,,,,,,,,,,
heavy school bags,us,,,,,,,,60.0,,
drawstring school bags,us,,,,,,,,10.0,,
st right school bags,us,,,,,,,,250.0,,
back to school welcome bags,us,,,,,,,,,,
pink school bags for girls,us,,,,,,,,50.0,,
school bags for girls adidas,us,,,,,,,,10.0,,
bags for school amazon,us,,,,,,,,,,
bentley school bags,us,,,,,,,,20.0,,
school bags for teenagers boys,us,,,,,,,,10.0,,
genie school bags for girls,us,,,,,,,,1200.0,,
school bags in china,us,,,,,,,,10.0,,
smiggle girl school bags,us,,,,,,,,10.0,,
best school bags for toddlers,us,,,,,,,,10.0,,
sling school bags,us,5.0,,,,sling bag,,,,,
valentino school bags,us,,,,,,,,,,
kids school bags for boys,us,,,,,,,,40.0,,
90s school bags india,us,,,,,,,,250.0,,
school bags with multiple compartments,us,,,,,,,,20.0,,
messenger school bags for girls,us,,,,,,,,,,
school gift bags,us,,,,,,,,10.0,,
school bags store,us,,,,,,,,10.0,,
bloom purple genie school bags,us,,,,,,,,10.0,,
online school bags for adults,us,,,1.0,,,,,,,
cute black bags for school,us,,,,,,,,30.0,,
year 5 school bags,us,,,,,,,,10.0,,
nike bags school,us,,,,,,,,30.0,,
teen bags for school,us,,,,,,,,,,
school bags pna,us,,,,,,,,60.0,,
new look school bags,us,,,,,,,,150.0,,
nike school bags price in south africa,us,,,,,,,,30.0,,
jute school bags,us,,,,,,,,50.0,,
chair bags for school south africa,us,,,,,,,,50.0,,
schuh school bags,us,,,,,,,,80.0,,
name brand school bags,us,,,,,,,,20.0,,
book bags for school for boys,us,,,,,,,,,,
school bags made from recycled materials,us,,,,,,,,10.0,,
goodie bags homemade back to school gifts for students,us,,,,,,,,10.0,,
school bags for 5 years old girl,us,,,,,,,,40.0,,
school bags for teenage boy,us,,,,,,,,30.0,,
dark academia school bags,us,,,,,,,,,,
sunday school thanksgiving treat bags,us,,,0.0,,,,,,,
gps tracker for school bags,us,,,,,,,,10.0,,
sanrio bags for school,us,,,,,,,,20.0,,
school bags cool,us,,,,,,,,20.0,,
for a school fundraiser troy sold 28 bags,us,,,,,,,,,,
school bags for 7 year old boy,us,,,,,,,,30.0,,
school bags for teenager,us,,,,,,,,,,
school bags with secret compartments,us,,,,,,,,10.0,,
pink vans school bags,us,,,,,,,,20.0,,
accessorize school bags,us,,,,,,,,10.0,,
heavy school bags solutions,us,,,,,,,,20.0,,
kids school bags uk,us,,,,,,,,30.0,,
shark school bags,us,,,,,,,,,,
end of the school year goodie bags,us,,,,,,,,,,
elverys school bags,us,,,,,,,,,,
school bags for 10th class,us,,,,,,,,40.0,,
school bags for kids with price,us,,,0.0,,,,,,,
beslan elementary school number 1 rows of body bags,us,,,0.0,,,,,,,
goody bags for high school dance team,us,,,0.0,,,,,,,
"goodie bags for first graders first day of school ""sticker is to remind you",us,,,0.0,,,,,,,
school bags bulk buy,us,,,0.0,,,,,10.0,,
back to school tote bags college,us,,,,,,,,,,
wallmart cartoon wheel school bags,us,,,0.0,,,,,,,
little girl school bags,us,,,,,,,,,,
kipling bags for school,us,,,,,,,,50.0,,
new bags for school,us,,,,,,,,100.0,,
cute school bags for girl,us,,,,,,,,40.0,,
skybags school bags price list,us,,,,,,,,20.0,,
ross school bags,us,,,,,,,,,,
school bags under 300,us,,,,,,,,60.0,,
school go bags,us,,,,,,,,,,
goody bags pre school,us,,,0.0,,,,,,,
school bags afterpay,us,,,,,,,,,,
paw patrol school bags,us,,,,,,,,40.0,,
school bags for teen,us,,,,,,,,10.0,,
rectangle school bags,us,,,,,,,,20.0,,
shoulder bags for school boys,us,,,,,,,,20.0,,
back to school 6th grade book bags,us,,,0.0,,,,,,,
red fortnite school bags,us,,,0.0,,,,,,,
stylish school bags for guys,us,,,,,,,,10.0,,
old school bags in india,us,,,,,,,,70.0,,
wwe school bags,us,,,,,,,,10.0,,
school bags photos,us,,,,,,,,40.0,,
latest school bags for girls,us,,,,,,,,20.0,,
pe bags school,us,,,,,,,,,,
school black bags,us,,,,,,,,60.0,,
quality school bags,us,,,,,,,,100.0,,
school kids bags,us,,,,,,,,60.0,,
school bags 9 year old,us,,,,,,,,10.0,,
school bags with lunch bags,us,,,,,,,,20.0,,
where to buy school bags in singapore,us,,,,,,,,100.0,,
school bags for girl in pakistan online,us,,,,,,,,300.0,,
emoji school bags ireland,us,,,0.0,,,,,,,
blizzard bags for school,us,,,,,,,,,,
kids book bags for school,us,7.0,,,,,,,,,
adidas school bags blue,us,,,,,,,,20.0,,
orthopedic school bags,us,,,,,totem backpack,,,150.0,,
school backpack black and white dinosaur skeleton waterproof student book bags by wihve,us,,,0.0,,,,,,,
small rolling backpack sesame street elmo haha 12 school bags,us,,,0.0,,,,,,,
school bags north face,us,,,,,,,,30.0,,
neon school bags,us,,,,,,,,20.0,,
square bags for school,us,,,,,,,,20.0,,
cute bags for girls for school black,us,,,,,,,,80.0,,
school bags navy blue,us,,,,,,,,20.0,,
school bags price in pakistan,us,,,,,,,,100.0,,
library bags for school,us,,,,,,,,30.0,,
wheelie bags for school,us,,,,,,,,250.0,,
school bags for boys high school,us,,,,,,,,10.0,,
walmart book bags for school,us,,,,,,,,,,
staples school bags,us,,,,,,,,60.0,,
school wheel bags,us,,,,,,,,10.0,,
skechers school bags,us,,,,,,,,30.0,,
trendy school bags 2018,us,,,0.0,,,,,,,
school bags deals 2016,us,,,0.0,,,,,,,
school duffle bags,us,,,,,,,,,,
latest girls school bags,us,,,0.0,,,,,,,
school bags pink,us,,,,,,,,60.0,,
tomboy school bags,us,,,,,,,,20.0,,
cute tote bags for nursing school,us,,,0.0,,,,,,,
kids school bags png,us,,,,,,,,20.0,,
benetton school bags,us,,,,,,,,50.0,,
us polo school bags,us,,,,,,,,50.0,,
school backpacks with lunch bags,us,,,,,,,,,,
school bags canada,us,,,,,,,,70.0,,
high school tote bags for school,us,,,,,,,,10.0,,
toddler school bags with wheels,us,,,,,,,,100.0,,
what to put in high school senior gift bags,us,,,,,,,,,,
high quality school bags,us,,,,,,,,30.0,,
cute school bags for toddlers,us,,,,,,,,20.0,,
what school bags are in fashion,us,,,,,,,,20.0,,
school bags for 10 year old boy,us,,,,,,,,30.0,,
